title,publish_date,update_date,img_url,caption_text,tags_list,full_article,url
Vietnam proposes halting passenger trains through Hanois famous railway cafe street,"Jan 07, 2026, 12:00 PM","Jan 07, 2026, 12:35 PM",https://cassette.sphdigital.com.sg/image/straitstimes/8714fd9931e8239e123c4810f42ca7239f22a15443958cf685bca67b6ea40110,"The railway cafe street, located mainly in the Kham Thien and Phung Hung areas, has become one of Hanois most photographed attractions in recent years.ST PHOTO: LIM YAOHUI","['Vietnam', 'Tourist attractions', 'Cafes and bakeries', 'Railways']","HANOI – Hanoi has proposed suspending passenger train services on the section of railway running through the so-called railway cafe street, a popular tourist spot where cafes line both sides of an active rail track in the city centre. In a recent document sent to the Ministry of Construction, the municipal Peoples Committee asked that passenger services on the national railway section between Hanoi Station and Gia Lam Station be adjusted. Under the proposal, southbound passenger trains would terminate at Hanoi Station, while northbound services would stop at Gia Lam. Passenger transfers between the two stations would be handled by the citys construction and transport authorities. If implemented, the change would mean there will be no passenger trains passing through the stretch of track between Hanoi Station and Long Bien Station, where the cafe-lined railway runs through densely populated neighbourhoods in the inner city. The city has also asked the ministry to hand over the management of national railway infrastructure on the Gia Lam–Hanoi section by the second quarter of 2026. This would allow the capital to carry out urban renewal and conservation projects on the western edge of the Old Quarter and the eastern area of the central heritage zone around the Imperial Citadel of Thang Long. The railway cafe street, located mainly in the Kham Thien and Phung Hung areas of Hoan Kiem district, has become one of Hanois most photographed attractions in recent years – to the chagrin of local authorities. Videos and images of tourists sipping coffee just centimetres from rumbling trains have gone viral on social media platforms, drawing large numbers of foreign visitors. Local authorities have repeatedly warned that the site poses serious safety risks. The cafes operate on land originally designated as a railway safety corridor, where construction and commercial activities are prohibited. During peak tourist hours, visitors often crowd onto the tracks to take photos, obstructing the railway and leaving little room for error when trains pass through. Over the past few years, Hanoi has launched several enforcement campaigns, temporarily closing cafes and ordering tourists to leave the area when trains are due. Yet, the measures have proved difficult to sustain, as businesses often reopen once inspections end and tourists continue to be drawn by the sites online fame. According to the city government, the proposal is part of a broader plan to preserve and enhance the historical and cultural value of the railway corridor, particularly around the iconic Long Bien Bridge where there is also the train track. The city is working with the French Embassys economic agency on a technical assistance project to study renovation options for the bridge, focusing on traffic safety and heritage conservation. Hanoi also plans to develop cultural, service and tourism spaces around the 131 stone railway arches beneath the elevated track running from Hanoi Station to Long Bien, along streets such as Phung Hung and Gam Cau. These arches have already been partially transformed into art spaces and cafes in recent years. At the same time, the city says it will study architectural solutions for the planned urban railway Line No. 1 as it passes through the Old Quarter and the French Quarter, with the aim of avoiding damage to the areas historic urban fabric. VIETNAM NEWS/ASIA NEWS NETWORK",https://www.straitstimes.com/asia/se-asia/vietnam-proposes-halting-passenger-trains-through-hanois-famous-railway-cafe-street
Chinas top diplomat heads to key strategic points in Africa,"Jan 07, 2026, 11:56 AM","Jan 07, 2026, 11:56 AM",https://cassette.sphdigital.com.sg/image/straitstimes/0ed942b7e5406f623ad170969cd93c016975323d997d50e0c767532dcaf6c359,"Chinese Foreign Minister Wang Yi delivers delivers his speech at the opening ceremony of the Lanting Forum in Beijing, China, October 27, 2025. REUTERS/Maxim Shemetov","['China', 'Wang Yi', 'Xi Jinping']","BEIJING, Jan 7 - Chinas top diplomat began his annual New Year tour of Africa on Wednesday, with a focus on the strategically important east, as the worlds No.2 economy seeks to reinforce its influence on the continent. Foreign Minister Wang Yi will travel to Ethiopia, Somalia, Tanzania and Lesotho on this years trip. Wangs visit to Somalia - the first by a Chinese foreign minister since the 1980s - is likely to provide Mogadishu with a diplomatic boost after Israel last month became the first country to formally recognise the breakaway Republic of Somaliland, a northern region that declared itself independent in 1991. Beijing, which reiterated its support for Somalia after the Israeli announcement, is keen to buttress its influence around the Gulf of Aden, the entry to the Red Sea and a crucial corridor for Chinese trade heading through the Suez Canal to European markets. Further south, Tanzania is central to Beijings push to secure access to Africas vast copper deposits. Chinese firms are refurbishing the Tazara Railway that runs through the country into Zambia. Li Qiang made a landmark trip to Zambia in November, the first visit by a Chinese premier in 28 years. The railway is widely seen as a counterweight to the U.S. and European Union-backed Lobito Corridor, which connects Zambia to Atlantic ports via Angola and the Democratic Republic of the Congo. By visiting the southern African kingdom of Lesotho, Wang aims to highlight Beijings push to position itself as a champion of free trade. Last year, China offered tariff-free market access to its $19 trillion economy for the worlds poorest nations, fulfilling a pledge by Chinese President Xi Jinping at the 2024 China-Africa Cooperation summit in Beijing. Lesotho, one of the worlds poorest nations with a gross domestic product of just over $2 billion, was among the countries hardest hit by U.S. President Donald Trumps sweeping tariffs last year, facing duties of up to 50% on its exports to the United States. REUTERS",https://www.straitstimes.com/asia/chinas-top-diplomat-heads-to-key-strategic-points-in-africa
"Magnitude 6.7 earthquake strikes near Baculin, Philippines: USGS","Jan 07, 2026, 11:40 AM","Jan 07, 2026, 11:56 AM",https://cassette.sphdigital.com.sg/image/straitstimes/14968fb67a4df230cfa900954c6ff6e4d08ab8f79c3247ca4fd95f79d8952a1c,The earthquake struck at a depth of 10km on Jan 7.PHOTO: SCREENGRAB FROM US GEOLOGICAL SURVEY,"['Philippines', 'Earthquakes', 'Natural disasters']","A 6.7-magnitude earthquake struck 68km east of Baculin in the Philippines, at a depth of 10km on Jan 7, the US Geological Survey (USGS) said. Philippine seismology agency Phivolcs said damage and aftershocks were expected from the offshore tremor. There were no immediate reports of damage or injuries from the earthquake. It was not that strong, but people rushed outside, said Joey Monato, the local police chief of the southern town of Hinatuan in Surigao del Sur province. REUTERS",https://www.straitstimes.com/asia/se-asia/magnitude-6-7-earthquake-strikes-near-baculin-philippines-usgs-says
"Japan says Chinas dual-use export ban unacceptable, rare earths in crosshairs","Jan 07, 2026, 11:16 AM","Jan 07, 2026, 12:23 PM",https://cassette.sphdigital.com.sg/image/straitstimes/9a33e153e6fc0fe8da27807af51959566442e93537475850d0cb56f70dbb9a50,"While Japan has sought to diversify its supply of rare earths, around 60 per cent of its imports still come from China.PHOTO: REUTERS","['China', 'Japan', 'Sanae Takaichi', 'Trade', 'Defence and military']","TOKYO - Japans top government spokesperson said on Jan 7 thatChinas ban on exports of dual-use itemsto the country was absolutely unacceptable and deeply regrettable, as a diplomatic dispute between Asias top two economies ramped up. Dual-use items are goods, software or technologies that have both civilian and military applications, including certain rare earth elements that are essential for making drones and chips. Japanese Prime Minister Sanae Takaichi touched off the dispute with Beijing late in 2025 by saying a Chinese attack on democratically-governed Taiwan could be deemed an existential threat to Japan. China regards Taiwan as part of its territory, a claim the island rejects. Beijing has demanded she retract the remarks,which she has not done, prompting a series of countermeasures, the latest of which was the ban on exports of dual-use items for military use on Jan 6. A measure such as this, targeting only our country, differs significantly from international practice, is absolutely unacceptable and deeply regrettable, Japans Chief Cabinet Secretary Minoru Kihara told a daily press conference on Jan 7. He declined to comment on the possible impact on Japanese industry, saying it remained unclear exactly what items would be targeted. The reaction from markets to the news was relatively muted though Japanese shares were lower on Jan 7, bucking a global trend that carried US and European benchmarks to record highs. Japans broad Topix gauge of equities slid 0.55 per cent, with a subindex of mining shares leading declines, down 3.2 per cent. China Daily, a newspaper owned by the ruling Chinese Communist Party, reported on Jan 6 that Beijing was considering tightening the licence review of rare earth exports to Japan more broadly, citing sources with knowledge of the matter. Such a move could have sweeping implications for the manufacturing powerhouse, including its key automotive sector, analysts say. While Japan has sought to diversify its supply of rare earths since China last throttled exports of the minerals in 2010, around 60 per cent of its imports still come from China. A three-month curb on Chinese exports of rare earths, like that seen during the 2010, could cost Japanese businesses 660 billion yen (S$5.4 billion) and shave 0.11 per cent of annual gross domestic product, Nomura Research Institute economist Takahide Kiuchi said in a note on Jan 7. A year-long ban would knock 0.43 per cent off GDP, he added. So far, China Customs data has shown no sign of a decline in rare earth exports to Japan, though the data is released with some delay. In November, the latest month for which there was data, exports grew 35 per cent to 305 tonnes, the highest tally in 2025. REUTERS",https://www.straitstimes.com/asia/east-asia/japan-says-chinas-dual-use-export-ban-unacceptable-rare-earths-in-crosshairs
Daiso is now the go-to store in South Korea for premium K-beauty products,"Jan 07, 2026, 11:11 AM","Jan 07, 2026, 11:23 AM",https://cassette.sphdigital.com.sg/image/straitstimes/b44443f830c2956563d57f7a38e2aa6ab920724499ee3acd27efef1a1c6834e9,"A dedicated beauty section at the Daiso store in Starfield Suwon, in South Korea.PHOTO: ASUNG DAISO","['South Korea', 'Beauty industry', 'Shopping']","SEOUL - For years, South Koreas beauty shopping map seemed fixed: Olive Young at the centre, flanked by department stores on one end and bargain channels on the other. That hierarchy is now quietly shifting. The countrys dollar-store chain Daiso, long associated with household essentials and impulse buys, is emerging as an unlikely but increasingly influential beauty destination. What stands out is not simply the presence of low-priced cosmetics, but who is choosing to sell them there. Premium and professional brands that once kept a clear distance from flat-price channels are now moving in deliberately, reframing Daiso as more than a testing ground for small labels. Instead, it is becoming a strategic stage in brand planning. The clearest such signal came with the launch of Zoom by Jung Saem Mool, a Daiso-exclusive collaboration with the renowned, artist-led brand, unveiled online on Jan 5. Thirteen items - including skin pads, spatula foundations and foundation cushions – went on sale with prices ranging from 1,000 won (90 Singapore cents) to 5,000 won. This carried symbolic weight for a brand whose base products typically sell for 40,000 to 50,000 won, and which limits discounting even at major retailers. Jung Saem Mools arrival at Daiso underscores how far the dollar store has evolved from its former cheap-only image. Daiso said the launch aligns with its broader direction. As with other categories, we aim to introduce a wider variety of products in our beauty lineup, the company said, adding that the collaboration was designed to allow more customers to easily experience beauty products that reflect makeup artist Jung Saem-mools expertise in their everyday routines. Jung Saem Mool is not alone. Daisos beauty shelves have expanded well beyond their earlier focus on road-shop staples such as Tonymoly and Nature Republic. The lineup now includes derma and pharmaceutical-backed brands such as CNP and Dongkook Pharmaceutical, alongside established skincare names including VT and Medipeel. Some brands appear under their original names, while others operate Daiso-only secondary lines. Many are developing Daiso-exclusive lines from the planning stage, with separate pricing, compositions and target consumers. This approach minimises brand dilution while allowing labels to work within Daisos fixed price structure. The appeal is not limited to a single generation. According to Daiso membership data, cosmetic sales in November 2025 were evenly distributed across age groups from shoppers in their 20s to those aged 60 and older. Consumers in their 40s accounted for the largest share, while those in their 20s and 30s also formed a core customer base. An industry expert said sustaining the trend will require balance. For premium brands to continue launching Daiso-exclusive lines, the key challenge lies in maintaining clear quality standards, transparency in labeling and advertising, and positioning differences from existing lines in a way consumers can clearly understand, the expert said. THE KOREA HERALD/ASIA NEWS NETWORK",https://www.straitstimes.com/asia/east-asia/daiso-is-now-the-go-to-store-in-south-korea-for-premium-k-beauty-products
JB businesses with ground-floor units must now install at least 3 CCTVs as part of safety push,"Jan 07, 2026, 11:05 AM","Jan 07, 2026, 12:27 PM",https://cassette.sphdigital.com.sg/image/straitstimes/c49bbfcffe786751295217bb21aabf5f92ee7fb1994b0fd8be685d2d59af7b12,"Business licence holders are responsible for the installation, maintenance and operation of the CCTV cameras.PHOTO ILLUSTRATION: PEXELS","['Malaysia', 'Surveillance', 'Crime']","JOHOR BAHRU – It is now mandatory for ground-floor commercial premises within the purview of the Johor Bahru City Council (MBJB) to install no fewer than three CCTV cameras for safety. Johor Bahru Mayor Mohd Haffiz Ahmad said it was a new licensing requirement to keep the city safe. All premises must have at least three units, two installed at the front, covering the five-foot way and one at the rear or back door, he said while chairing the councils monthly full board meeting. Datuk Mohd Haffiz said MBJB was the first local authority to implement such a rule and had started notifying business owners. The mayor said the move was part of the councils efforts to enhance surveillance. He added that to renew their licence, business owners must submit CCTV images with a recent date as proof of compliance, even if the licence was issued in 2025, while new applicants must install CCTV cameras within 90 days of licence approval. Licence holders are also completely responsible for the installation, maintenance and operation of the CCTV cameras. Equipment such as network video recorders and display monitors must be placed within the premises and monitored by the business owner, said Mr Mohd Haffiz. However, the council reserves the right to review CCTV recordings, with police cooperation, for enforcement and public safety, he added. A functional CCTV system can help deter crime, support investigations and reduce the number of security staff needed in high-risk or vast areas. Mr Mohd Haffiz said the move was aligned with the Johor Smart City agenda and goal for a secure urban environment. THE STAR/ASIA NEWS NETWORK",https://www.straitstimes.com/asia/se-asia/jb-businesses-with-ground-floor-units-must-now-install-at-least-3-cctvs-as-part-of-safety-push
China takes punitive actions on three Taiwanese for independence activities,"Jan 07, 2026, 10:41 AM","Jan 07, 2026, 12:11 PM",https://cassette.sphdigital.com.sg/image/straitstimes/07596ad85044704ba72beca55e1320944c27367888e5922379579553d818bb74,"Beijing claims Taiwan as its own territory, which Taipei rejects.PHOTO ILLUSTRATION: REUTERS","['Taiwan', 'China', 'Hong Kong', 'Bans', 'Territorial disputes']","BEIJING- China will take punitive actions against three Taiwanese for their involvement in separatist activities related to Taiwan independence, its Taiwan Affairs Office said on Jan 7. One of the people was named as an accomplice in separatist activities and faces lifelong accountability. Two of the others, as well as their relatives, will be banned from entering the mainland, Hong Kong and Macau, the offices spokesman Chen Binhua told reporters at a weekly news briefing. Mr Chen said the purpose of the actions against a small number of Taiwan independence diehards is to fundamentally safeguard national sovereignty and territorial integrity, and that it was not aimed at the Taiwanese in general. Beijing claims Taiwan as its own territory, which Taipei rejects. REUTERS",https://www.straitstimes.com/asia/east-asia/china-takes-punitive-actions-on-three-taiwanese-for-independence-activities
"Yemens STC leader al-Zubaidi flees, Saudi-backed coalition says","Jan 07, 2026, 12:36 PM","Jan 07, 2026, 12:36 PM",https://cassette.sphdigital.com.sg/image/straitstimes/5809caee5b6a87a8915d427f60c37768639b5dea21c02773d9ea5625bad08e18,"Billboards with images of Sheikh Mohamed bin Zayed Al Nahyan, President of the United Arab Emirates and Aidarous al-Zubaidi, the head of the UAE-backed separatist Southern Transitional Council (STC), in Aden, Yemen, December 30, 2025. REUTERS/Fawaz Salman","['Yemen', 'Saudi Arabia']","Jan 7 - The leader of Yemens Southern Transitional Council (STC), Aidarous al-Zubaidi, failed to board a plane set to take him to Riyadh, and fled instead to an unknown destination, the Saudi-backed coalition in the country said on Wednesday. The remarks came amid efforts to end fighting that erupted last month between the STC, backed by the United Arab Emirates, and Yemens Saudi-backed internationally recognised government, which has triggered a major feud between the Gulf allies. Zubaidi was set to travel to Saudi Arabia days after Yemens government said it had asked Riyadh to host a forum on the southern issue. In a statement, coalition spokesperson Turki al-Maliki said a flight carrying a large number of senior leaders of the separatist group departed after a delay of more than three hours without Zubaidi, and with no information on his whereabouts. During the delay information became available indicating that he had moved large forces, Maliki added, citing calls for mobilisation and the movement and arming of factions with light and medium weapons. The feud between the UAE and Saudi Arabia has fractured a coalition originally created to fight the Iran-aligned Houthis, who are still the dominant military force in Yemen. The Houthis seized the Yemeni capital of Sanaa in 2014 and Gulf countries intervened the following year in support of the internationally recognised government, splitting Yemen into rival zones of control. The coalition also said it carried out limited pre-emptive airstrikes in Yemens southern province of al-Dhalea after monitoring the movements of armed forces that had left their camps. Domestic sources and sources within the STC reported more than 15 strikes in the province, the birthplace of Zubaidi. Following the developments, the Saudi-backed presidential council stripped Zubaidi of his membership and referred him to the public prosecutor on charges including high treason, state news agency SABA said. The decision, issued by council chairman Rashad al-Alimi, accused Zubaidi of inciting armed rebellion, attacking constitutional authorities and committing abuses against civilians in southern Yemen. For years, the STC has been part of Yemens internationally- recognised government. REUTERS",https://www.straitstimes.com/world/yemens-stc-leader-al-zubaidi-flees-saudi-backed-coalition-says
