title,publish_date,update_date,img_url,caption_text,tags_list,full_article,url
"For three hours, my hands were busy. No spreadsheet was involved","Jan 11, 2026, 05:00 AM","Jan 11, 2026, 05:00 AM",https://cassette.sphdigital.com.sg/image/straitstimes/33956b4d3748a060f2140dc962f463de7747be771d31107f745286fd2c3a94a7,"Cheeseboard making at Tombalek, a beautiful local woodcraft studio.PHOTO: COURTESY OF SONNY SANTOS","['Finding Joy', 'Ageing', 'Happiness']","As someone born way before Google and ChatGPT were created, I distinctly remember the days when we actually had to use something called a library. It was a building filled with dead trees bound in covers, and if I wanted to know the capital of Paraguay, I had to ask a person, a librarian, who generally seems to know everything. Occasionally, friends half my age will ask me about this Paleolithic period of information retrieval.",https://www.straitstimes.com/opinion/for-three-hours-my-hands-were-busy-no-spreadsheet-was-involved
Tidy shelves and neater homes? What I got wrong about decluttering,"Jan 10, 2026, 05:00 AM","Jan 10, 2026, 05:28 AM",https://cassette.sphdigital.com.sg/image/straitstimes/26577e5233a62ad418a9124a203f71af43af56655ef0ade3c06da3a777724b7b,"Decluttering is, ultimately, an act of love, says the writer. By making those decisions ourselves, we spare children and loved ones uncertainty and grief.PHOTO: ISTOCKPHOTO","['Ageing', 'Families', 'Living Well']","I once thought decluttering was about tidy shelves and neat homes, a la the annual spring-cleaning regimen that I grew up with. But when my maternal grandmother died – and later, my mother – I realised it was about something deeper: how we choose to live and leave. Let me elaborate. Sorting the belongings of loved ones who have passed away was not just a physical exercise. It was emotional work, heavy with memories and personal struggle on what to keep and what to give away. After several weekends of sifting through items with church friends, I donated most of my grandmothers and mothers things to The Salvation Army.",https://www.straitstimes.com/opinion/tidy-shelves-and-neater-homes-what-i-got-wrong-about-decluttering
Much wayang behind Quad ambassadors Beijing meeting,"Jan 10, 2026, 05:00 AM","Jan 10, 2026, 12:39 PM",https://cassette.sphdigital.com.sg/image/straitstimes/0b5c210b7cbe3ea0cad7c248a228571865a84304d997cea4f1653d14c0e7fdd1,A news broadcast in Beijing on Chinas Justice Mission 2025 military drills around Taiwan. These were Chinas most extensive drills by coverage area to date.PHOTO: REUTERS,"['Quad', 'US-China ties', 'US foreign policy', 'China', 'Taiwan tensions']","It wasnt the first time that ambassadors to China of the Quad nations – US, Japan, Australia and India – had met as a group in Beijing, as they have in other capitals as well. But in diplomacy, timing and location take on much meaning. What is more, US Ambassador David Perdues move to publicise the Dec 30 meeting he hosted, complete with a picture of the four envoys gathered in front of the seal of the United States, was clearly aimed at making a point.",https://www.straitstimes.com/opinion/much-wayang-behind-quad-ambassadors-beijing-meeting
"A tale of two cities, two Isetans and a retail conundrum","Jan 10, 2026, 05:00 AM","Jan 10, 2026, 06:07 AM",https://cassette.sphdigital.com.sg/image/straitstimes/1f66f50a060addb7bde5791c1adfad3fb8d2a55885370b4cb33a4d28c91c6de8,"After Isetan Serangoon Central (pictured) at NEX shopping mall closes in April, Isetan Scotts will be the brands sole Singapore outlet.ST PHOTO: KUA CHEE SIONG","['Department stores', 'Retail', 'Luxury brands', 'Shopping', 'Online shopping']","A wealthy, impeccably groomed woman steps into an ultra-prestigious department store in an upmarket shopping district. Renowned as the trendiest retailer in the country, the store offers the finest in fashion, accessories, homeware and food – so aspirational that many office ladies regard the ability to shop freely at its supermarket as a life milestone. At another department store operated by the same Japanese parent company and located, like the other, in an upmarket shopping area, it attracts a slightly above-mass-market clientele who, reflecting the tropical climate, are typically dressed in a more casual style.",https://www.straitstimes.com/opinion/a-tale-of-two-cities-two-isetans-and-a-retail-conundrum
How to AI-proof your job,"Jan 09, 2026, 05:30 PM","Jan 10, 2026, 05:35 AM",https://cassette.sphdigital.com.sg/image/straitstimes/202b62e9d39d8277e8ee86ef5e1c6f0a3129838c6b5d11f62cade066e09628e5,Statistics showed occupations that have fared best combine quantitative abilities and interpersonal skills like social perceptiveness.PHOTO ILLUSTRATION: PIXABAY,"['Artificial Intelligence', 'Job cuts', 'Labour market', 'Employers', 'Employment']","Its not a sentiment that will come naturally to many given the often eye-watering salaries of those in question, but 2026 is looking like the year we will need to develop sympathy for the coders and quants. Anyone who has used the latest iterations of agentic artificial intelligence coding tools will have seen for themselves that over the past few weeks we have unquestionably crossed a threshold: The ability to write code to build real, functioning software or quickly gather and analyse data to answer questions has switched overnight from a scarce and specialist talent to a routine and ubiquitous skill.",https://www.straitstimes.com/opinion/how-to-ai-proof-your-job
Overseas volunteering must move beyond personal fulfilment and good intentions,"Jan 09, 2026, 05:00 AM","Jan 09, 2026, 05:00 AM",https://cassette.sphdigital.com.sg/image/straitstimes/729ebff949bc1102469ddabd27001d505f0955dce0547860cdfe6e069c5977dd,"Senior nurse clinician Maria Jumhasan (in orange) demonstrating how to manage a breech delivery at a district hospital in Chennai, Tamil Nadu.PHOTO: SINGAPORE INTERNATIONAL FOUNDATION","['Volunteering', 'Singaporeans', 'Asean', 'Geopolitics']","In her usual job, Dr Shephali Tagore is a senior consultant at KK Womens and Childrens Hospital where one of her specialisations is high-risk obstetrics. But as an overseas volunteer with the Singapore International Foundation (SIF),shefinds herself in a district hospital in the Indian state of Tamil Nadu, standing beside a local nurse who has just helped save a mother during a complicated birth. Although Dr Tagore is the one with extensive clinical experience, she is more than happy to guide and empower local healthcare staff even amid a difficult situation. The procedure is fast, improvised, and carried out with scarce resources, yet masterfully done. Afterwards, the nurse tells DrTagore: We have always had the skills, its the confidence that changed.",https://www.straitstimes.com/opinion/overseas-volunteering-must-move-beyond-personal-fulfilment-and-good-intentions
Forum: Ensuring accessible and fair resolution of workplace discrimination,"Jan 09, 2026, 05:00 AM","Jan 09, 2026, 05:00 AM",,,"['Today\'s Letters', 'Ministry of Manpower', 'Employers']","We refer to the commentary Taking employers to task over discrimination: How easy is the legal process? (Dec 29) by Ms Sugidha Nithiananthan and Ms Caitlin C. Fernandez, and Ms Mizue SaucosForum letter, Improve access to justice at the Employment Claims Tribunal (Jan 6). The Workplace Fairness (Dispute Resolution) Act provides a structured avenue for redress starting with direct engagement between parties. If resolution fails, mandatory mediation follows before a case can proceed to adjudication. This tiered approach emphasises amicable outcomes to preserve workplace harmony. The Employment Claims Tribunals (ECT) offers a simplified and guided process that is accessible, affordable, and expeditious with safeguards against frivolous claims. The Acts framework does not permit legal representation at the ECT; however, workers and employers may seek legal advice outside proceedings or assistance through their respective unions. Judges in ECT proceedings proactively identify relevant issues and see that pertinent evidence is presented. To assist litigants who may not be legally trained, registrars will provide procedural guidance. As Ms Sauco notes, self-presented parties may apply for family members or friends to provide non-legal support during hearings, via the Community Courts and Tribunals Friend Scheme. More details are available on theSG Courts website (self-help guides). The decisions of the ECT – as courts of law – must be grounded in evidence where parties must prove their case. These procedural rules are essential to ensure that credible evidence is presented and that employers and workers are treated equally. The ECT ensures due process through a rigorous procedure and has maintained a consistent pace in doing so. While the duration between the filing of the claim and the first case management conference varies, most cases continue to be concluded within six months, notwithstanding a 67 per cent increase in claims between 2021 and 2025. The judiciary continues to refine its processes to remain user-centric and accessible, including modernising digital platforms for audio and video evidence submission. Workplace discrimination cases can be complex, and public awareness and education are key. The Ministry of Manpower and the Tripartite Alliance for Fair and Progressive Employment Practices are stepping up public outreach and education efforts, including the development of a handbook to provide clear and practical guidance to help employers and workers understand and apply the law in the workplace. Tan Li ShengDivisional Director, Workplace Policy andStrategy DivisionMinistry of Manpower Mark Khng Director, Admin & Operations (Community Courts & Tribunals)Singapore Courts",https://www.straitstimes.com/opinion/forum/forum-ensuring-accessible-and-fair-resolution-of-workplace-discrimination
Forum: Johor-Singapore SEZ can be genuine blueprint for shared prosperity,"Jan 09, 2026, 05:00 AM","Jan 09, 2026, 05:00 AM",,,"['Today\'s Letters', 'Singapore-Malaysia ties', 'Johor Bahru', 'Sharing economy']","In the Opinion piece Johor-Singapore SEZ: Be careful the opportunity doesnt become an oversell (Jan 6), Mr Damien Dujacquier wisely cautioned that the Johor-Singapore Special Economic Zone (JS-SEZ) must not become an oversold opportunity. He astutely observed that the zone has moved beyond concept to meaningfully capture investor attention, serving as a litmus test for ASEANs ability to build resilient, border-transcending growth. Indeed, the JS-SEZ has evolved into a major regional priority, attracting significant investment. It represents a modern economic model, moving beyond cheap labour to prioritise proximity, resilience and sustainability. The complementary strengths of Singapores global connectivity and Johors land and manufacturing base create a powerful formula for supply-chain security, allowing companies to withstand global shocks. But as Mr Dujacquier noted, the real test lies in execution, not ambition. Physical bridges like the Johor Bahru-Singapore Rapid Transit System Link are crucial, but the bureaucratic bridge of regulatory alignment is paramount. The formidable challenge is not infrastructure, but harmonising rules and processes. History shows incentives alone cannot compensate for weak fundamentals. To succeed in the long term, the JS-SEZ must adopt transformative measures. There needs to be a joint statutory authority with the power to fast-track approvals, and a regulatory sandbox for innovation. A digital-first border with seamless biometric clearance and shared platforms must be built, making the crossing feel invisible and turning pilot schemes into reality. Critically, success depends on people. A shared skills and innovation corridor is essential to prepare the workforce for the 400,000 high-income jobs that the JS-SEZ is aiming to create. A future skills fund can ensure inclusive growth by upskilling locals, mitigating social risks like housing affordability. Furthermore, investment incentives should be tied to tangible outcomes like high-quality job creation, and not just be blanket tax holidays. The ultimate measure of success will not be short-term factory counts, but whether in 15 years, the border feels like a seam within a single, fluid and globally competitive ecosystem. Keith Wong",https://www.straitstimes.com/opinion/forum/forum-johor-singapore-sez-can-be-genuine-blueprint-for-shared-prosperity
Rare comic introducing Superman sells privately for US$15 million,"Jan 10, 2026, 02:45 PM","Jan 10, 2026, 02:45 PM",https://cassette.sphdigital.com.sg/image/straitstimes/283bd05c6f98b128932afd734a696694241509acc6c4c1f99ba2a17dafba803e,The sale price makes this issue one of the most expensive comics ever sold.PHOTO: NEWSHUB,"['Comics', 'Collectors/Collections', 'Auctions']","A copy of the comic book that introduced the world to Superman in 1938 has been sold to a collector for US$15 million (S$19.3 million). The private sale of a high-grade copy of Action Comics No. 1 was announced on Jan 9. Fewer than 100 copies are known to exist, said Mr Vincent Zurzolo, president of Metropolis Collectibles and ComicConnect, which negotiated the sale. The sale price makes the issue one of themost expensive comics ever sold. The auction record remains with Superman No. 1, from 1939, which sold for US$9.12 million in November. This is the advent of the golden age of comics, and Action Comics No. 1 is the holy grail of holy grails, Mr Zurzolo said in an interview.Action Comics No. 1 is widely considered to be the first American comic book to include superheroes and contributed to a rapid increase in the genres popularity in the mid-20th century. Both the buyer and seller asked to remain anonymous. The history of this particular copy, which originally sold for 10 cents, is a saga of its own. In 1996, Hollywood actor Nicolas Cage purchased it from Metropolis Collectibles and ComicConnect for US$150,000, Mr Zurzolo said. In 2000, the comic was stolen from Cages home during a party and remained missing until 2011, when it was discovered in a storage unit in California, Mr Zurzolo said. During the 11 years it was missing, the issue skyrocketed in value, Mr Stephen Fishler, chief executive officer of Metropolis and ComicConnect, said in a news release. The comic was returned to Cage, who sold it for US$2.2 million at auction. If this wasnt stolen, it would have been sold with the rest of his collection much earlier and would have sold for far less, Mr Zurzolo said. In essence, because of the theft and recovery, Nicks windfall on this comic book was enormous. The Certified Guaranty Co., which specialises in authenticating and grading collectibles, gave the issue a grade of 9.0, meaning the comic is well-preserved but has minor defects. It joins several other comics that have fetched multi-million-dollar prices at auction and in private sales. At least eight copies of Action Comics No. 1 have now sold for more than US$1 million, according to the CGC. NYTIMES",https://www.straitstimes.com/life/rare-comic-introducing-superman-sells-privately-for-us15-million
Alans Universe creator finetunes secret sauce for YouTube hits,"Jan 10, 2026, 02:30 PM","Jan 10, 2026, 02:30 PM",https://cassette.sphdigital.com.sg/image/straitstimes/d0465c158136c00c56595b28e407b3cba97e2da94f35d414e69a5daff662a289,"Alan Chikin Chow, creator of the YouTube series Alans Universe, at his production studio in Burbank, California.PHOTO: PHILIP CHEUNG/NYTIMES","['YouTube', 'Celebrities', 'Social media']","BURBANK, California – To understand why Alan Chikin Chow is one of the most successful creators on YouTube, watch the first 18 seconds of My Boyfriend Is A Werewolf?! The video, part of his series Alans Universe, opens with paper airplanes zipping around a classroom whose pastel colours and clean-cut teenagers radiatethe aesthetics of American teen sitcom Saved By The Bell (1989 to 1992).",https://www.straitstimes.com/life/alans-universe-creator-finetunes-secret-sauce-for-youtube-hits
