title,publish_date,update_date,img_url,caption_text,tags_list,full_article,url
Stop saying no more bubble tea in 2026: How to set realistic New Year resolutions,"Jan 11, 2026, 05:00 AM","Jan 11, 2026, 05:00 AM",https://cassette.sphdigital.com.sg/image/straitstimes/a89d8304114adf11ca082d49cede8c2d30115aa29539e0c12f785727cd360133,2026 gives me the chance to set more practical resolutions that are attainable.ST ILLUSTRATION: CEL GULAPA,"['ST Headstart', 'ST Young & Savvy', 'Invest']","SINGAPORE –Thenew yearhas just begun, and with it, the setting of many unrealistic expectations that I have no hope of ever fulfilling. In previous years, I said things like no more bubble tea, exercise more, save more money and cut down on my travel spending!. None of those things ever came to pass. Some people try to get around this by setting resolutions that will definitely be achieved with no effort or that are vague enough that any little bit counts – things like save more could technically be achieved if I saved $1 more this year. Sometimes, resolutions are also based on what we see other people doing. Just opening Instagram during the last week of 2025 showed me lists of resolutions that perhaps work for others but are not tailored to my needs. Things like be happy or earn more reminded me of my own stop-buying-bubble-tea aspirations. So how do I go about setting useful, practical resolutions that can actually improve my financial health in 2026? I asked some experts for their top tips in goal setting. OCBC investment strategy managing director Vasu Menon said: Instead of vague resolutions, define measurable targets. He added that a way to ensure goals are not abandoned halfway is to break them up, such as setting a monthly savings target, instead of just saying save $20,000 in 2026. For instance, if I said I aim to save 20 per cent of my pay every month, that might be more useful than an annual target. UOB head of group personal financial services Jacquelyn Tan said: Make decisions from clarity rather than fear. On the surface, maybe that seemed rather general, but I realised, when reviewing my insurance policies for one, that decisions can indeed be made out of fear. As ahuge hypochondriac and aperson who has medical anxieties, I always fear the worst and bought insurance policies to cover me in health emergencies. I added any rider the agent said I should, and any other add-ons that he suggested, even if in hindsight, they were excessive or too expensive. Those decisions were made out of a mixture of fear and pressure from the insurance agent, rather than clarity in the types of protection that I wanted. DBS head of financial planning literacy Lorna Tan said that a goal can be to put idle cash to good use, such as investing. When it comes to high-yield savings accounts, there might be more cash than is needed to achieve the interest rates, and the extracan be put to use elsewhere. I guess a lot of my inaction just comes from sheer inertia. After a weeks worth of work, no one really wants to sit down at the laptop to do what I call personal admin – checking bank accounts, opening spreadsheets, paying credit card bills. But perhaps part of my goals could be setting aside time – maybe just once a month on a Saturday afternoon – to sit down and really look through my finances, review them and decide if I can put the money to better use. After consulting the experts, I created a list that hopefully is more realistic than those of previous years: Rather than saying no bubble tea, it seems more realistic to set a weekly cap for the drink. At the rate of price increases in todays economy, $10 may soon only be able to net me one cup of bubble tea. But the commitment would mean a sharp drop from the roughly $20 that I spent on three bubble teas a week in 2025. Cutting the amount in half will also save me from ingesting too much sugar – I hope. In 2025, I took a total of 16 flights, ranging from two hours to nearly 17 hours each time, and yet I earned and claimed a total of zero miles. A few weeks ago, I finally took the first step in miles collecting, by applying for a credit card. Id previously only stuck to debit cards because I didnt want to waste time and brain space thinking about miles or cashback. But after seeing more friends travel around the world for free – all flights redeemed through miles – I think upping my miles game is a good goal. And now that I am open to credit cards, maybe playing the miles game will be something that feels possible. The eventual goal is a free flight to London – some day. The Supplementary Retirement Scheme, or SRS, is a voluntary scheme to encourage people to save for retirement, over and above their Central Provident Fund savings. If contributions are made to the SRS account before Dec 31, one could gain some income tax relief in the following year of assessment. The yearlycapfor SRS contributions for Singapore citizens is $15,300, and the tax relief amount is the exact amount of SRS contributions made. The personal income tax relief cap of $80,000 applies to the total amount of all tax reliefs claimed, which includes the relief on SRS contributions. And while the SRS account does not earn the interest rate of 4 per cent that the CPF Special Account does, funds can be withdrawn with a penalty before the retirement age, rather than being absolutely locked in. SRS funds can also be invested in a wide variety of ways, such as unit trusts, SGX-listed stocks, real estate investment trusts (REITs) and exchange-traded funds (ETFs). This makes it an ideal way to cut down on the income tax I have to pay while allowing me to invest for long-term growth – it seems to be a win-win situation. Having compiled my little list of resolutions, what sort of goals are the real experts setting? OCBCs Mr Menon: In 2026, my goal is to take a more active role in managing my savings and investments to meet the multiple needs of my family. At 62, as a father of two young daughters aged eight and 10, financial planning is something I take very seriously. His aim: to have yield-generating assets as a significant part of his portfolio (bonds for coupon payments, stocks that pay dividends, unit trusts that invest in equities, fixed income), stocks for potential capital growth, and precious metals as a hedge against uncertainty. UOBs Ms Tan: My resolutions are to simplify decisions, strengthen resilience and stay invested in what truly compounds – financially and personally (including investing in personal relationships). I am less concerned with beating markets in any single year but rather more focused on ensuring my portfolio can compound steadily without forcing lifestyle trade-offs during volatility. DBS Ms Tan: This year, I plan to review my investments that are impacted by the low-interest-rate environment, and continue building sustainable multiple passive income flows to fund my retirement lifestyle. I have been contributing to the SRS and my penalty-free withdrawals over 10 years can start from age 62. Most of my SRS savings are invested in local stocks, which performed well last year (2025). Ive started to liquidate some of the stocks that I do not plan to keep in preparation for the penalty-free cash withdrawals that can commence in the coming years. I plan to place the cash component in safer instruments under SRS.",https://www.straitstimes.com/business/invest/stop-saying-no-more-bubble-tea-in-2026-how-to-set-realistic-new-year-resolutions
Me and My Money: He sees shoe shining and restoration as a craft and career,"Jan 11, 2026, 05:00 AM","Jan 11, 2026, 05:00 AM",https://cassette.sphdigital.com.sg/image/straitstimes/e791b54dee8f3a253148895e55d6715bf5589ff0b9e7f0ec2663838cdb930487,"Mr John Chung, founder of Mason and Smith and Margo and Smith, chose shoemaking apprenticeships overseas to hone his craft over going to university.ST PHOTO: GAVIN FOO","['ST Headstart', 'ST Me & My Money', 'Invest', 'Money Mentor']","SINGAPORE – The traditional services of shoe shining and shoe restoration get a modern twist from Mr John Chung, who has managed to turn them into a viable business. He is the founder of Mason and Smith, which offers artisanal shoe care, and Margo and Smith, which deals in high-end handbag restoration. The business is also Singapores first shoe shine and repair salon with a dedicated luxury handbag restoration division. Mr Chung, 33, started his shoe shine ventures over a decade ago, when he was 21. He was accepted into Nanyang Technological University but chose to forgo higher education to pursue his business. He says: Im very hands-on and want to experience many things. I didnt come from a well-off family so I had to work to buy the things I wanted. It was indeed very difficult juggling studies and part-time work but I told myself one day I will be rewarded for my hard work and kept pushing on. Mr Chung started with just $700 and a fascination for second-hand leather shoes. In 2013, he began buying used leather shoes, restoring them by hand and selling them at local flea markets for a profit. In 2014, he introduced a shoe shine chair concept in collaboration with The Shoppes at Marina Bay Sands, offering traditional hand-polished shoe shine services from a classic chair set-up. In the following year, he launched Singapores first dedicated shoe shine bar – a concept that combined professional shoe repair with high-quality, hand-finished shoe shining in a refined setting. I developed a strong appreciation for leather as a material – its beauty, durability and ability to withstand the test of time. Some leather artifacts and collectibles can last for decades or even over a century, and the fact that they can be restored and revitalised after years of use truly captivated me, he recalls. To hone his craft, Mr Chung undertook a shoemaking apprenticeship in 2016 under Japanese shoemaker Masaru Okuyama in Hong Kong. He subsequently relocated to Japan to study shoemaking full time, apprenticing with several renowned bespoke shoemakers and immersing himself in traditional Japanese techniques. This magical quality of leather sparked a passion that led me to study the material in depth. I discovered that leather is most commonly used in footwear and bags, which pulled me deeper into the world of craftsmanship. That was the beginning of my journey – and of my love for shoes and bags, he says. His techniques are now showcased at his dual-concept flagship store in Ann Siang Road. He has also launched his own ready-to-wear and made-to-order footwear line, alongside digital initiatives to modernise the leather care experience, such as tele-consultations and digital order tracking. Mr Chung is an A-level holder and his wife, 31, helps to run the business. A:I bought my first stock while serving in the army – it marked the beginning of my self-taught journey in finance and investing. Without formal academic training, I committed myself to learning independently – reading financial news daily, tracking market movements, and staying informed on global economic trends. Over time, I developed a strong focus on equity investing, alongside a growing interest in the Singapore property market, which I study closely out of a deep curiosity for how value is created and preserved over time. Since I do not have a university degree, Ive always treated every subject I pursue as a kind of mini degree – a self-directed course in lifelong learning, grounded in discipline, consistency and passion. Because of my work in shoemaking and restoration, I also invest time in studying leathercraft and footwear construction. Understanding the materials, history and techniques behind each piece enhances my craft and deepens my connection to it. A:I dont collect tangible pieces purely for their potential to appreciate in value – what draws me in are the artistry and story behind each object. Over the years, Ive gathered a few meaningful items that reflect my appreciation for craftsmanship. Among them are vintage footwear from the 1970s and 1980s made by Nikolaus Tuczek, a legendary bespoke shoemaker whose work continues to inspire shoemakers even today. I also collect vinyl records, and one of my most prized possessions is a rare recording by Teresa Teng – a piece that carries both personal and cultural significance. In addition, I own a few select watches crafted by Otsuka Lotec, a small but respected Japanese watchmaker whose mechanical precision and understated design deeply resonate with me. Each item in my collection reflects a moment, a maker or a tradition that I admire. For me, collecting is not about building a portfolio – its about honouring the beauty of craft, history and human expression. A:Ive always had a passion for collecting mechanical items like CDs and cameras – theres something fascinating about the precision and craftsmanship behind them. Music has played a huge role in my life growing up. My dad was a big fan of hi-fi systems, and many of my childhood memories are wrapped in the sounds of songs and tunes that still stay with me vividly. Alongside this love for music, my fascination with shoes grew over time and eventually blossomed into the business I run today. Im also an avid vinyl record collector, constantly drawn to the warmth and authenticity that only records can capture. A:One of my biggest financial mistakes happened early in my investing journey, around the age of 18 to 20. Back then, I would often buy stocks simply because they were popular or seemed like the next big thing. Id scan the news, anticipate price movements, and trade hastily based on headlines – almost like gambling. Many of those stocks performed poorly over time, leading to disappointing results. The experience taught me the critical importance of doing thorough research and exercising patience. A:One of my notable experiences was buying my home during the Covid-19 pandemic. I wanted to handle the entire transaction myself but didnt know where to start, so I began by studying the Council for Estate Agencies, or CEA, textbook. This gave me a solid foundation in the basics of home ownership. From there, I dived deeper – reading books and researching various details to ensure I was well-informed throughout the process. Ultimately, I found a well-valued home in Tampines, which has since appreciated by $200,000. A:Growing up, my family lived simply and frugally, which instilled in me a mindset of making the most out of what you have. That background helped shape the values I brought into my business – prioritising function, sustainability and thoughtful spending over flashy beginnings. A:I wanted to be a footballer. I did join the national junior under-14 soccer team eventually, but I grew out of that dream. A:I own a four-room resale flat in the east. A:A green Volkswagen Golf. A:I would kick-start the day with a good run, have an amazing and nutritious breakfast and spend time with my loved ones. A:I would set aside a portion to donate to those in need, as giving back has always been important to me. Since I was 18, Ive been actively visiting orphanages overseas and have made it a point to give whenever I can. With the remainder, I would invest in property – an area Ive studied closely and believe in for long-term growth and stability. A:Buy a second-hand item, add value to it, sell it and continuously flip it multiple times with various different products for profit. This is probably the best way to increase that small pot of cash and grow it quickly.",https://www.straitstimes.com/business/invest/me-and-my-money-he-sees-shoe-shining-and-restoration-as-a-craft-and-career
Woman wants to sell young sons $2m condo but cant show its for his benefit,"Jan 11, 2026, 05:00 AM","Jan 11, 2026, 05:41 AM",https://cassette.sphdigital.com.sg/image/straitstimes/6bf5d8f0e6f804fa5b441d74b6e9baa9456611d852fe0630bce8d3fcdaa47fc4,The High Court disallowed a woman from selling a property that is held on trust for her young son as she could not convince the judge that the sale was for his benefit.ST ILLUSTRATION: MANNY FRANCISCO,"['Invest', 'Taxation', 'Iras', 'Property investments', 'Financial literacy']","SINGAPORE - A woman put a $2 million apartment on trust for her then six-year-old son but wanted to sell it when the value of the property went up by about $500,000. But her decision hit a major roadblock when she applied to the High Court for permission to sell because she could not convince the judge that the sale was for the benefit of the son, who is the owner of the property.",https://www.straitstimes.com/business/invest/woman-wants-to-sell-young-sons-2m-condo-but-cant-show-its-for-his-benefit
US banks concerned over Trump call to slash credit card rates,"Jan 11, 2026, 01:57 AM","Jan 11, 2026, 01:58 AM",https://cassette.sphdigital.com.sg/image/straitstimes/22a0f8acb6450b1d34e9557ad3afa84f98c14210ec0e34b240c0250b068b13c7,US President Donald Trump - facing midterm elections in November 2026 - has called for a 10 per cent cap on credit card interest rates.PHOTO: DOUG MILLS/NYTIMES,"['United States', 'Donald Trump', 'Credit/Debit cards', 'Banks and financial institutions']","WASHINGTON - The US banking industry is warning that President Donald Trumps plans to lower credit card costs would make credit less available and hurt consumers and businesses. Mr Trump said on Jan 9 that effective Jan 20, the first anniversary of his administration, he was calling for a 10 per cent cap on credit card interest rates. We will no longer let the American Public be ripped off by Credit Card Companies that are charging Interest Rates of 20 to 30%, he said on Truth Social. Five associations representing US banks responded that they shared the presidents goal of helping Americans access more affordable credit. At the same time, evidence shows that a 10 percent interest rate cap would reduce credit availability and be devastating for millions of American families and small business owners who rely on and value their credit cards, the associations said in a joint statement late on Jan 9. If enacted, this cap would only drive consumers toward less regulated, more costly alternatives, it said. The statement was issued by the American Bankers Association, Bank Policy Institute, Consumer Bankers Association, Financial Services Forum and Independent Community Bankers of America. Credit cards are the primary source of consumer credit in the United States. Costs and outstanding balances have soared in recent years as people increasingly rely on them to maintain spending, even for basic necessities. According to data from the Federal Reserve, the total outstanding credit card debt exceeded US$1.23 trillion (S$1.5 trillion) at the end of September – the fourth-largest source of household debt, after mortgages, student loans and auto loans. Interest rates on credit cards are at least 21 per cent and can reach as high as 38 per cent for borrowers with a higher risk profile, according to the Fed. This is up from an average of around 12 per cent a decade ago. With midterm elections due in November, Mr Trump is under pressure to reduce the cost of living as promised during his 2024 election campaign amid stubborn inflation and consumers complaints that they struggle to make ends meet. Senator Elizabeth Warren, the top Democrat on the Senate Banking Committee, voiced scepticism that Mr Trump was serious about capping rates, noting that he has sought to shutter the Consumer Financial Protection Bureau (CFPB), a consumer watchdog. Begging credit card companies to play nice is a joke, Ms Warren said in a statement on Jan 9. Trump doesnt care about affordability. AFP",https://www.straitstimes.com/business/banking/us-banks-concerned-over-trump-call-to-slash-credit-card-rates
"S&P 500 notches record high close driven by Broadcom, other chipmakers","Jan 10, 2026, 06:27 AM","Jan 10, 2026, 06:28 AM",https://cassette.sphdigital.com.sg/image/straitstimes/c4fec04033b10c712d5eed82c6bf5228d784052b4070a2e0b136d64115e16f0f,"Traders working on the floor of the New York Stock Exchange, in New York City.PHOTO: REUTERS","['Stocks and shares', 'Dow Jones', 'Nasdaq']","NEW YORK - The S&P 500 rallied to a record high close on Jan 9, lifted by Broadcom and other chipmakers, while a weaker-than-expected jobs report did little to alter expectations of interest rate cuts from the Federal Reserve this year. Wall Streets three main indexes all gained sharply in 2026s first full week of trading, fuelled by increases in materials, industrials and other sectors that have lagged technology stocks in recent years. A Labour Department report showed US employment growth slowed more than expected in December, but a decline in the unemployment rate to 4.4 per cent suggested the labour market was not rapidly deteriorating. Chip stocks rallied, with the PHLX semiconductor index jumping 2.7 per cent to a record high. Lam Research rallied 8.7 per cent to US$218.36 after Mizuho raised its price target on the chip manufacturing tool maker to US$220 from US$200. Broadcom rose 3.8 per cent, Alphabet added 1 per cent and Tesla climbed 2.1 per cent, all lifting the S&P 500 and Nasdaq. Vistra jumped 10.5 per cent after Meta Platforms agreed to buy power from the companys nuclear plants. On the overall AI theme, investors are getting granular and picking the winners and losers in terms of sub-themes and individual names, said Mr Zachary Hill, head of portfolio management at Horizon Investments in Charlotte, North Carolina. We view that as a more positive development. It means that were getting closer to the monetisation phase, where people can actually see and touch the revenue enhancements that are going to come from this revolutionary technology. Intel rallied almost 11 per cent after Mr Trump said he had a great meeting with the chipmakers chief executive officer, Mr Lip-Bu Tan. The S&P 500 climbed 0.65 per cent to end the session at 6,966.28 points. The Nasdaq gained 0.82 per cent to 23,671.35 points, while the Dow Jones Industrial Average rose 0.48 per cent to 49,504.07 points. Nine of the 11 S&P 500 sector indexes rose, led by materials, up 1.8 per cent, followed by a 1.24 per cent gain in utilities. For the week, the S&P 500 climbed 1.6 per cent, the Nasdaq rose 1.9 per cent and the Dow added 2.3 per cent. Valuations on Wall Street were relatively high ahead of fourth-quarter earnings season. The S&P 500 is trading at about 22 times expected earnings, down from 23 in November, but above its five-year average of 19, according to LSEG data. Underscoring a recent shift towards stocks that have underperformed in recent years, the S&P 500 value index has climbed about 2 per cent so far in 2026, beating a 1 per cent gain in the S&P 500 growth index. The US Supreme Court said it would not issue a ruling on Jan 9 on the legality of US President Donald Trumps sweeping tariffs. This left investors, many of whom expected a decision, awaiting clarity. Traders anticipate heightened volatility across financial markets if the court strikes down the tariffs. Mortgage lenders rose a day after Mr Trump said he is ordering his representatives to buy US$200 billion in mortgage bonds to bring down housing costs. LoanDepot surged 19.3 per cent, Rocket Companies gained 9.6 per cent and Opendoor Technologies rallied 13.1 per cent. The Philadelphia Housing index gained 5.7 per cent to its highest since October. General Motors shares fell more than 2 per cent after the automaker said on Jan 8 it would take a US$6 billion charge to unwind some electric-vehicle investments. Advancing issues outnumbered falling ones within the S&P 500 by a 1.3-to-one ratio. The S&P 500 posted 48 new highs and 6 new lows; the Nasdaq recorded 140 new highs and 62 new lows. Volume on US exchanges was relatively heavy, with 17 billion shares traded, compared to an average of 16.4 billion shares over the previous 20 sessions. REUTERS",https://www.straitstimes.com/business/companies-markets/sp-500-notches-record-high-close-driven-by-broadcom-other-chipmakers
"Man bought 12 insurance policies, then fell to his death overseas in bizarre case","Jan 10, 2026, 05:00 AM","Jan 11, 2026, 05:41 AM",https://cassette.sphdigital.com.sg/image/straitstimes/f2ccf42f79280e74faaef0057f6bd4f7a5d030261298a781edc7c5d35ba59b7c,A man over-insured himself for $7 million before he fell to his death in a bizarre overseas accident.PHOTO: LIANHE ZAOBAO,"['Invest', 'Insurance', 'Property investments', 'Financial literacy']","SINGAPORE - It sounded like something from a TV series – a man bought multiple insurance policies to insure himself for millions of dollars and then died in a bizarre overseas accident not long after. The Singapore man, who used to be an insurance agent before working as an accountant, had signed up for a total of 12 life policies which covered him for almost $7 million.",https://www.straitstimes.com/business/invest/man-bought-12-insurance-policies-then-fell-to-his-death-overseas-in-bizarre-case
