title,publish_date,update_date,img_url,caption_text,tags_list,full_article,url
Uvalde school shooting trial interrupted on day one over former teachers evidence,"Jan 07, 2026, 10:16 AM","Jan 07, 2026, 10:16 AM",https://cassette.sphdigital.com.sg/image/straitstimes/acc5c8c27faf23d9a83121cd184c051f48cbcf1461995c44c69619864d03d241,"A couple visits memorial crosses in front of Robb Elementary School, as U.S. Attorney General Merrick Garland announces the results of a review into the law enforcement response to a 2022 mass shooting in Uvalde, Texas, U.S., January 18, 2024. REUTERS/Kaylee Greenlee Beal/File Photo",['Police'],"Jan 6 - The first day of the trial of a police officer who responded to the 2022 shooting at a Texas elementary school that killed 19 students and two teachers was interrupted on Tuesday after a witness provided testimony not previously presented to the defense. Texas state Judge Sid Harle dismissed the jury until Thursday and ordered the prosecution and defense to return on Wednesday to work through the issues raised by the testimony from a former teacher at the Robb Elementary School in Uvalde. The defenses objections to the testimony could lead to it being stricken, or to the extreme and rarely granted remedy of a mistrial. Former Uvalde school district police officer Adrian Gonzales, 52, is on trial in Nueces County Court in Corpus Christi for his role as one of 376 officers from local, state and federal agencies who responded to the shooting. Police were criticized for waiting 77 minutes before entering the classroom where the gunman was holed up, despite teachers and students making calls to 911 emergency services, saying they were in the room with the gunman and surrounded by bodies. The trial was moved to Corpus Christi after the defense successfully argued Gonzales could not get a fair trial in Uvalde. Gonzales has pleaded not guilty to the 29 counts of child endangerment he faces for allegedly failing to confront the gunman, who was later killed by other officers. Stephanie Hale, who was a third grade teacher at the school on the day, testified that she saw the gunman on the south side of the school and also that she saw dust kicked up on that side of the school, potentially indicating that shots were fired. Defense lawyer Jason Goss, during cross examination, said he was surprised by Hales testimony and that she did not tell police or a grand jury about seeing the gunman or seeing dust kicked up when she spoke with investigators after the shooting. Hale was then allowed to listen to the interview she gave investigators shortly after the shooting, without the jury present. Goss asked Hale if she would now agree that she never told investigators that she had seen the gunman or dirt flying up, to which Hale replied: Correct. Hale was then asked by Goss if, during preparation for the trial, she had told prosecutors details about seeing the gunman and the dirt, to which she replied: I believe so, yes. Goss said that if Hale had reported such matters to the prosecution, his side was entitled to have been informed before trial under U.S. law. This is a trial by ambush, Goss said in court, evoking the legal requirement that the prosecution not be surprised by the defense with evidence. Uvalde County District Attorney Christina Mitchell, who is overseeing the prosecution, told the judge that Hale had never told her team the specific location where she had seen the gunman or that she saw dirt flying up. Outside court, the main defense lawyer, Nico LaHood, told reporters that a mistrial is a remedy allowed by law, but were not saying were going to take that remedy or not, or argue for that remedy. DID WHAT HE COULD Gonzales, who had spent a decade as a Uvalde city police officer before joining the school districts force about a year before the shooting, was charged in 2024 with the child endangerment counts, according to his indictment, which said that he failed to engage, distract, and delay the shooter and that he also failed to follow his active shooter training to respond to gun fire by advancing toward the gun fire. Each count carries the possibility of two years in prison to run concurrently. Adrian Gonzales does nothing more than mike his microphone and tell other officers whats going on, special prosecutor Bill Turner told the jury during his opening statement, repeatedly choking back tears as he spoke in the courtroom in Corpus Christi, Texas, where the trial was moved after the defense argued Gonzales could not get a fair trial in Uvalde. The children inside the building were hiding and waiting for officers to come to their aid, the prosecutor added, but Gonzales and other police waited outside as the slaughter begins. Two defense attorneys, in their opening statement, emphasized the chaotic scene and said that at no point did Gonzales see the gunman or fully understand where the gunman was, making it difficult to confront him. He did what he could with what he knew at the time, LaHood said of his client. Pedro Pete Arredondo, the former chief of the Uvalde schools police and the person who investigators say was the officer in charge of the scene, faces 10 counts of child endangerment. His trial has not yet been scheduled. State and federal investigations into the shooting found that officers left the 18-year-old gunman alone inside the classroom with children while weighing how to confront him. REUTERS",https://www.straitstimes.com/world/uvalde-school-shooting-trial-interrupted-on-day-one-over-former-teachers-evidence
Video recordings by Brown University shooting suspect deemed a confession,"Jan 07, 2026, 09:56 AM","Jan 07, 2026, 09:56 AM",https://cassette.sphdigital.com.sg/image/straitstimes/2af5261c60bbfe4b1788bde4e2202f6239ac9ad217f1139acecf9d83b09e3130,"FILE PHOTO: The Barus & Holley engineering building remains closed as the manhunt continues for the gunman, following a shooting at Brown University in Providence, Rhode Island, U.S. December 17, 2025. REUTERS/Taylor Coester/File Photo",['Videos'],"BOSTON, Jan 6 - Federal prosecutors on Tuesday released transcripts of video recordings in which they say the gunman who carried out last months fatal mass shooting at Brown University and later took his own life had admitted to planning the attack months in advance. The four videos recorded by the suspect, Claudio Neves Valente, were discovered during a search of the storage locker in Salem, New Hampshire, where he was found dead from a self-inflicted gunshot on December 18, ending a six-day manhunt, the prosecutors said. Valente, 48, a Portuguese national who had attended Brown two decades ago as a doctoral student in physics, slipped into an engineering building on the Ivy League campus on December 13 and opened fire with a handgun, killing two students and injuring nine others, according to police. Authorities later determined that after fleeing the Providence, Rhode Island, scene of the Brown attack, Valente killed a physics professor from the Massachusetts Institute of Technology in a separate shooting at his home outside Boston. Valente and the slain MIT professor Nuno Loureiro had once been classmates in Lisbon, authorities said after linking the two shooting incidents. But investigators have yet to offer a motive for either case. The newly released transcripts of the videos, recovered by the FBI from an electronic device and translated from Portuguese to English, mark the first statements attributed to Valente since his death but shed little new light on the Brown tragedy. According to the U.S. Attorneys Office in Boston, which has overseen the federal investigation of the shootings, Valente admitted that he had been planning the Brown University shooting for a long time. In the rambling, disjointed recordings prosecutors say he made while holed up in the storage unit after the shootings, Valente refers to a shell casing injuring one of his eyes and adds that he had already planned this for a little more than six semesters. Except for repeated mentions of his eye injury, however, Valente speaks elliptically of what has happened, never explicitly talks about firing a gun or killing anyone, and offers no insights into what precipitated the violence ascribed to him. I dont know if there are any kind of implications of what I wanted to do or not, he said. It was all incompetent, but at least something was done. ... The only objective was to [pause] leave more or less on my own terms and -- and its -- its already long overdue. He alludes to vague, unspecified grievances, while expressing no remorse. To say that I was extraordinarily satisfied, no, but I also dont regret what I did, he said in one video. I am not going to apologize, because during my lifetime no one sincerely apologized to me. Federal prosecutors said that the evidence collected to date continues to rule out any basis for concerns about ongoing public safety threats associated with the shootings, but that investigators search for a motive would continue. REUTERS",https://www.straitstimes.com/world/video-recordings-by-brown-university-shooting-suspect-deemed-a-confession
"US FDA to limit regulation of health and fitness wearables, commissioner says","Jan 07, 2026, 09:55 AM","Jan 07, 2026, 10:27 AM",https://cassette.sphdigital.com.sg/image/straitstimes/8829512782f64a6358412745d74d959de882dbe8e0ec19139078dcfa44c1a971,The US FDA has issued new guidance to clarify its regulatory approach on wearable devices.PHOTO: REUTERS,"['Technology sector', 'Wearable gadgets', 'Fitness gadgets']","The US Food and Drug Administration (FDA) said on Jan 6 that it will limit regulation of wearable devices and software designed to support healthy lifestyles, issuing new guidance to clarify its regulatory approach. The guidance, along with comments from FDA commissioner Marty Makary, adds to existing policy that classifies low-risk wellness tools, such as fitness apps and activity trackers that encourage exercise, as non-medical devices exempt from stringent regulation, provided they do not make claims related to disease diagnosis or treatment. We have to promote these products, and at the same time, just guard against major safety concerns, Mr Makary said in an interview with Fox Business about artificial intelligence (AI) software such as ChatGPT, adding that if people are looking up a symptom on an AI-based tool, lets have that conversation when they come in to see their doctor or do a virtual visit. Shares of continuous glucose monitor manufacturers Abbott, Medtronic and Dexcom closed between 1 per cent and 4 per cent higher. US-listed shares of fitness smartwatch maker Garmin ended nearly 3 per cent higher. We want to let companies know, with very clear guidance, that if their device or software is simply providing information, they can do that without FDA regulation, Mr Makary told Fox Business. The only stipulation is if they make claims of something being medical grade... like blood pressure measurement. We dont want people changing their medicine based on something thats just a screening tool or an estimate of a physiologic parameter. In 2025, the FDA issued a warning letter to fitness band maker Whoop, saying its blood-pressure insights feature blurred the line between wellness and medical devices by estimating systolic and diastolic values used to diagnose hypertension. The agency also sent out a broader warning to consumers about the risks posed by unauthorised devices. REUTERS",https://www.straitstimes.com/world/united-states/us-fda-to-limit-regulation-of-health-and-fitness-wearables-commissioner-says
How not to get captured in Trumps TV show foreign policy,"Jan 07, 2026, 05:00 AM","Jan 07, 2026, 05:00 AM",https://cassette.sphdigital.com.sg/image/straitstimes/bc1e858c620d54fedb59006420ac27c9599dbed7c1720559c35f41faf9aa6389,Captured Venezuelan President Nicolas Maduro arriving at the Downtown Manhattan Heliport in New York City on Jan 5.PHOTO: REUTERS,"['Venezuela', 'Donald Trump', 'US foreign policy']","After months of rising tension, includinga massing of military strength in the Caribbean, the US conflict with Venezuela has reached a boiling point. In a scenario unthinkable in earlier eras of American foreign policy, just after the world chimed in a new year, the US military, acting on the orders of President Donald Trump,seized Venezuelan President Nicolas Maduroin a targeted overnight raid. Mr Trump proudly announced that Maduro had been captured and posted a picture of him blindfolded, handcuffed and in the custody of US officers. Overnight, Maduro was brought to New York to face drug trafficking and terrorism charges. The entire episode is bewildering. Imagine the reaction if the roles were reversed – had Venezuelan commandos come into the United States and captured Mr Trump and brought him to Caracas to face charges.",https://www.straitstimes.com/opinion/how-not-to-get-captured-in-trumps-tv-show-foreign-policy
Forum: Concerned over synchronised fee hikes at driving centres,"Jan 07, 2026, 05:00 AM",,,,"['Today\'s Letters', 'CCCS/Competition and Consumer Commission of Singapore', 'Competition laws', 'Cars']","The decision by the three driving centres in Singapore – ComfortDelGro Driving Centre, Bukit Batok Driving Centre and Singapore Safety Driving Centre – to raise fees from Jan 1 for practical lessons, theory classes and simulator training bears the hallmarks of cartel-like behaviour that penalises consumers (Driving centres in Singapore hike learner fees in 2026, Jan 4). The fee hikes, ranging from 6.8 per cent to over 25.2 per cent for specific modules, are being implemented at a time when learners are already struggling with a bottlenecked system. The demand for learning slots now far outstrips supply. This chronic imbalance has created a market where driving centres have zero incentive to improve productivity or streamline operations. Instead, they operate in a sellers market where learners have no choice but to pay whatever is demanded just to secure a slot. When all players in a limited market raise prices at the same time, it suggests a lack of genuine competition. In a healthy, competitive landscape, at least one provider would maintain or lower prices to capture the massive overflow of demand. Instead, we see a coordinated upward trend that suggests the centres are comfortable increasing fees with impunity, knowing that their customer base is captive and desperate. The justifications provided – such as rising operational costs and instructor wages – must be scrutinised. If productivity is not being enhanced to offset these costs, the burden is simply shifted to the young Singaporeans and workers for whom a driving licence is a vital asset for employment. I urge the Competition and Consumer Commission of Singaporeto investigate the fee structures. We need to ensure that the price adjustments are a result of market forces and not a lack of competitive spirit among the only three providers in the country. Phoon Kok Hwa",https://www.straitstimes.com/opinion/forum/forum-concerned-over-synchronised-fee-hikes-at-driving-centres
Forum: Bring down CIQ costs for pleasure craft owners in Singapore,"Jan 07, 2026, 05:00 AM","Jan 07, 2026, 05:37 AM",,,"['Today\'s Letters', 'Travel and leisure', 'Singapore Customs']","I wish to highlight the high cost faced by owners of pleasure craft (boats used for sport, recreational or leisure purposes) when leaving and entering Singapore, and to urge the Maritime and Port Authority of Singapore (MPA) and Immigration and Checkpoints Authority (ICA) to consider a more practical and affordable alternative. Pleasure craft can clear Customs, immigration and quarantine (CIQ) only at a few designated private marinas. These marinas typically charge about $300 per clearance, purportedly to cover armed guards and the maintenance of CIQ working space. Pleasure craft owners must also engage a licensed agent at a cost of about $200 per clearance, unless they furnish a bank bond of $5,000 to ICA to act as their own agent. As a result, a single outbound clearance costs about $500, and a simple weekend round trip to nearby destinations such as Batam or Bintan can cost up to $1,000 in clearance fees. This is prohibitively expensive. Countries such as Indonesia and Thailand allow pleasure craft owners to complete CIQ procedures themselves, without engaging agents or renting private marina facilities, at costs amounting to only tens of Singapore dollars. While ICA can conduct CIQ procedures at Marina South Pier (MSP), MPA does not permit pleasure craft to berth there for CIQ purposes, even though cruise ships are allowed to do so. Instead, pleasure craft owners who want to save on marina CIQ charges are required to charter water launches from private marinas to MSP, adding several hundred dollars to the process and nullifying the intended savings. I suggest MPA consider allowing pleasure craft to berth at MSP for CIQ purposes, and that ICA let pleasure craft owners submit CIQ documentation directly without requiring a large bank bond. This would remove the need for costly third-party agents and marina fees. Such changes would promote maritime tourism and benefit Singapore pleasure craft owners as well as visiting boats, and would bring Singapores CIQ practices in line with those of most other maritime nations. Goh Ee Kiat",https://www.straitstimes.com/opinion/forum/forum-bring-down-ciq-costs-for-pleasure-craft-owners-in-singapore
"When seniors live alone, it doesnt mean they are lonely","Jan 07, 2026, 05:00 AM","Jan 07, 2026, 05:00 AM",https://cassette.sphdigital.com.sg/image/straitstimes/8eebedd6aa3606a23392606d7c75dc0421508b3f3be30e89bb2a17e320d32de6,"Research shows that some seniors are ageing across places, where home functions as a base and not a boundary, says the writer.PHOTO: ST FILE","['Senior citizens', 'Mental health', 'Social support']","Living alone in later life is widely seen as a signal of social risk. It is a convenient marker: easy to identify, easy to count, easy to target. In policy discussions, the one-person household often stands in for loneliness itself. While it may not cause immediate harm, this shorthand can quietly - and sometimes inaccurately - shape who gets noticed, who gets missed, and how support is delivered.",https://www.straitstimes.com/opinion/when-seniors-live-alone-it-doesnt-mean-they-are-lonely
Forum: Clothes for recycling piling up beside bin,"Jan 07, 2026, 05:00 AM","Jan 07, 2026, 05:00 AM",,,"['Today\'s Letters', 'Forum your picture', 'Recycling', 'Public health and hygiene']","At Block 1A in Eunos Crescent, there is often a pile of clothes strewn on the floor beside the textile recycling bin. Usually, I message the recycling company on WhatsApp, attaching a photo, but it takes days for it to collect the pile. It is an eyesore and a source of embarrassment when tourists or other residents pass by the bin and comment that the town is untidy. The tardiness in collection may also discourage people from their recycling efforts as the trouble they have taken seems unappreciated. The situation may worsen with the expected spring cleaning for the coming Chinese New Year. I hope those managing the recycling efforts will resolve the issue. A remote camera installed in the area would help the firm assess the situation better. Phuah Soon Ek",https://www.straitstimes.com/opinion/forum/forum-clothes-for-recycling-piling-up-beside-bin1
Rules of engagement for an honest debate on Singapores immigration policy,"Jan 07, 2026, 05:00 AM","Jan 07, 2026, 07:40 AM",https://cassette.sphdigital.com.sg/image/straitstimes/05cc7763d698f55cc912525ad98f5b15f86a6dc487c1ac2ca4408c95db5d237c,"In a proper, productive airing on immigration, we must accept that there are no solutions without costs, says the writer.ST PHOTO: LIM YAOHUI","['Singapore', 'Singapore population', 'Far right']","In much of the developed world, immigration has become and stayed the defining political problem governments are struggling with. Singapore, however, seems to be bucking that trend – at least if the public discourse of the last 12 months is any guide. One clue lies in what did not dominate the 2025 General Election. TheInstitute of Policy Studies post-election surveysshowed immigration was not among the top five issues voters were least satisfied with (the total fertility rate was; immigration came in sixth).",https://www.straitstimes.com/opinion/rules-of-engagement-for-an-honest-debate-on-singapores-immigration-policy
The problem with AI and empathy,"Jan 06, 2026, 03:00 PM","Jan 06, 2026, 03:00 PM",https://cassette.sphdigital.com.sg/image/straitstimes/7456abae23df26c4ef03f6e9d386b1973ea7d660eec2cde6aff9a1082938bfe5,"One problem with calling machines empathic is that it provides cover for actions which would otherwise feel morally uncomfortable, says the writer.PHOTO: REUTERS","['Artificial Intelligence', 'AI chatbot', 'ChatGPT']","One after another, the uniquely human traits we once thought would remain untouched by the rise of the machines have started to look vulnerable after all. First it was creativity. Is empathy next? If you have been reading the research of late, you could be forgiven for thinking so. In one study, a team of licensed healthcare professionals compared the responses of chatbots and real doctors with patient questions posed in an online forum. The chatbot responses were rated significantly higher, not just for quality, but for empathy.",https://www.straitstimes.com/opinion/the-problem-with-ai-and-empathy
Trump is unleashing forces beyond his control,"Jan 06, 2026, 02:00 PM","Jan 06, 2026, 08:27 PM",https://cassette.sphdigital.com.sg/image/straitstimes/5a30b95b1e2af2fa3f70a4d88e6c9dac0ef66108847042365622781c32b6b360,Not even the angriest opponents of Mr Donald Trumps intervention in Venezuela should whitewash the rule of Mr Nicolas Maduro.PHOTO: REUTERS,"['Venezuela', 'Donald Trump', 'Wars and conflicts', 'World War I', 'World War II']","War, Prussian military thinker Carl von Clausewitz wrote, is a mere continuation of policy by other means. If there is one line that virtually every army officer learns from Clausewitzs posthumously published 1832 book, On War, it is that description of the purpose of armed conflict. Those words were among the first that popped into my head when I woke up Saturday morning to the news that theUS military had attacked Venezuela, seized its dictator, Nicolas Maduro,and brought him to the US to face criminal charges.",https://www.straitstimes.com/opinion/trump-is-unleashing-forces-beyond-his-control
Johor-Singapore SEZ: Be careful the opportunity doesnt become an oversell,"Jan 06, 2026, 05:00 AM","Jan 06, 2026, 05:58 AM",https://cassette.sphdigital.com.sg/image/straitstimes/9afdc3bbee3eaeaf00bff012c29fc5047118a2c63b23366c6a344c11cc4a6e64,The Johor-Singapore Special Economic Zone (JS-SEZ) is beginning to capture meaningful investor attention.ST PHOTO: HARITH MUSTAFFA,"['Johor', 'Singapore economy', 'Supply chains', 'Asean']","Reflecting on the steady stream of inquiries from companies exploring entry into Johor and Singapore I have received this past year, it is increasingly evident that theJohor-Singapore Special Economic Zone (JS-SEZ)is beginning to capture meaningful investor attention. Sectors of interest include advanced manufacturing, logistics, data centres and renewable energy, driven by companies search for resilient and regionalised supply chains.",https://www.straitstimes.com/opinion/johor-singapore-sez-careful-the-opportunity-doesnt-become-an-oversell
