title,publish_date,update_date,img_url,caption_text,tags_list,full_article,url
India exporters risk losing US orders without January trade deal,"Jan 07, 2026, 09:56 AM","Jan 07, 2026, 11:17 AM",https://cassette.sphdigital.com.sg/image/straitstimes/42d949e2ffdce7a3153527eef45f82eebc2aeb4107770f32b3e02c9aea2301e4,"Garment workers stitch shirts at a textile factory in Hindupur town in Andhra Pradesh, India.PHOTO: REUTERS","['India', 'Tariffs', 'Trade']","MUMBAI- Indian exporters of products ranging from home decor to leather shoes are worried about missing the US summer shopping season if they are unable to lock in orders in January as trade-deal talks drag on between New Delhi and Washington. This will be the decisive month for sealing the trade pact so contracts can be secured for the first half of 2026, according to half a dozen local exporters who spoke to Bloomberg News. The punitive 50 per cent US tariffs since August already hurt the exporters order volumes in the typically busy winter and Christmas season in 2025. One of the steepest levies imposed by the Trump administration continue to deal a heavy blow to Indias labour-intensive sectors, especially textiles, handicrafts, apparels, gems and leather. Despite multiple rounds of talks, including four conversations between US President Donald Trump and Indian Prime Minister Narendra Modi since August, the slow progress in the trade deal has pressured the rupee and forced New Delhi to dole out US$5 billion (S$6.4 billion) to protect Indian exporters. Mr Rafeeque Ahmed, chairman of Farida Group, which is one of the largest shoemakers in India, said that Jan 15 is the cut-off date for securing bulk orders from the US to ensure stable revenue for the summer and autumn seasons. The company derives about 60 per cent of its export revenue from American markets. I have cut down production by 20 per cent to 25 per cent and laid off workers, said Mr Ahmed, who supplies to international brands like Cole Haan and Clarks. How long can we sustain this and keep giving discounts? Mr Trump, meanwhile continues to send mixed signals. He told reporters on Jan 4 that high tariffs had pushed New Delhi to reduce Russian oil imports. Mr Trump added that Mr Modi knew he was not happy, and because India trades with the US, we can raise tariffs on them very quickly, and it would be very bad for them – remarks that raised doubts about whether he intends to remain combative toward India or move to expedite a trade deal. Indias oil imports from Russia in December fell 40 per cent from a June peak of 2.1 million barrels a day, a noticeable gain for Mr Trump, who has intensified efforts to choke off cash flows to Russian President Vladimir Putins war machine and end the Ukraine conflict. In 2024, before trade headwinds darkened sentiment, India shipped goods worth US$87.4 billion to the US, accounting for almost one-fifth of the countrys total exports. US government trade data show apparel imports dropped by about 12 per cent to US$376 million in September 2025 compared with the year-ago period. Imports of rugs fell by 10 per cent to US$98.4 million over the same period. If the deal doesnt happen quickly then April-August and holiday shipping would be impacted, said Mr Gautam Nair, director of apparel maker Matrix Design. First half would then be a complete washout. As part of efforts to diversify its markets beyond the US, India in recent months has forged new free trade alliances with New Zealand, Oman and Britain. Negotiations with the EU, Australia, Chile and Peru are ongoing. To offset losses, many exporters are also scrambling to salvage supplier relationships by offering discounts or traveling abroad to secure new clients and reassure existing ones. Mr Lalit Thukral, founder of textile exporter Twenty Second Miles, said August through December is typically the busiest period for the industry, but this year it delivered losses instead. Preparing for tougher days ahead, he travelled to Britain with a 15-person delegation in November, looking for new customers. Mr R.K. Sivasubramaniam, whose company makes basics like underwear, will visit the US in January to scout for buyers. He has cut his production since August by 50 per cent. We are trying to get newer buyers but it is not possible to grab them immediately, he said, adding that this work trip was crucial for his business. Other US buyers are indefinitely gone. Mr Vijay Sethi, a director at Sethi Handicrafts, has lost several US clients despite offering discounts as much as 20 per cent. The maker of home decor products, based in a town just outside of New Delhi, has meetings with US buyers lined up in January. Several gems and jewelry exporters are experimenting with costly workarounds to blunt the impact of the tariff. Some have set up US subsidiaries to manage trade locally, while others are shifting parts of their manufacturing to countries like the United Arab Emirates, where duties are about 15 per cent, said Mr Sabyasachi Ray, executive director of the Gem and Jewellery Export Promotion Council. Theyve had to change the way of doing business, said Mr Ray. But the workarounds have taken a toll. Apparel suppliers such as Raymond Lifestyle and Gokaldas Exports, were among the firms considering moving some of their production to African countries. Gokaldas has four factories in Kenya and one in Ethiopia, while Raymond was looking to use its Ethiopia plant to supply American buyers, as tariffs in these countries are as low as 10 per cent. Exporters dont have much choice right now, said Dr Ajay Sahai, director general of Federation of Indian Export Organizations. They are looking at alternative markets, selling locally, and one thing has become very clear – we cant overly depend on the US for exports. BLOOMBERG",https://www.straitstimes.com/business/companies-markets/india-exporters-risk-losing-us-orders-without-january-trade-deal
"Wee Hur, partners break ground on Wycombe Abbey international school project in Hougang","Jan 07, 2026, 09:00 AM","Jan 07, 2026, 10:07 AM",https://cassette.sphdigital.com.sg/image/straitstimes/f5fb2aaf6f1d4523e59c6c8a0b2fdd8ba203bc0a9b2b1910993a1842a2d369db,"Chief investment officer Goh Wee Ping said Wee Hurs recent moves, such as developing the Wycombe Abbey school and acquiring Hotel Miramar – reflect a deliberate strategy to expand its repertoire.PHOTO: LIANHE ZAOBAO","['Singapore companies', 'Private school', 'Singapore property', 'The Business Times']","SINGAPORE - Property group Wee Hur is gearing up for a year of execution as it builds a pipeline of new projects, starting with the Wycombe Abbey School (Singapore) in Hougang Avenue 3. At the ground-breaking ceremony for the school on Jan 6, chief investment officer Goh Wee Ping said the project marked a significant milestone for the group, after more than 20 years in the education-related space. In 2004, Wee Hur built key amenities such as swimming pools, a sports field and basement halls for United World College in Dover Road. In 2022, the group erected a new 11-storey block with sports and recreational facilities at Tanglin Trust School. Wycombe Abbey School (Singapore) represents its latest step in the space,developed with joint venture partners Wycombe Abbey and BE Education. The project is part of Wycombe Abbey International Schools broader expansion in Asia, with campuses in mainland China and Hong Kong. Mr William Vanbergen, founder and chairman of BE Education, said the school aims to provide world-class education to thousands of students in Singapore over the coming decades. We want to be welcoming parents from all over the world, helping to attract top talent here to Singapore to help improve the whole economy, he said. The international school is among several projects announced by Wee Hur in 2025. These include the launch of its third fund, the single-asset WHF3A, which was set up for a new purpose-built student accommodation development in Grenfell Street in Adelaide, Australia. The fund has a committed capital of A$57 million (S$49 million) – of which at least A$12.6 million is from Wee Hur, as the sponsor; A$21.1 million is from the Goh directors; and up to A$23.3 million is from independent and unrelated investors such as family offices and high-net-worth individuals. Many were existing partners or repeat investors familiar with the groups track record and management team, Mr Goh told The Business Times. This third fund was raised relatively quickly, as much of the groundwork was already complete – the land had been approved for student housing, a builder appointed, and bank financing secured, said Mr Goh, who is also chief executive officer of Wee Hurs fund management arm, Wee Hur Capital. This shortened investors capital commitment to about two years, compared with closer to four years for earlier-stage developments. Were quite comfortable with the approach that we have, (where) we warehouse the land, we de-risk it, fundraise, and then we keep rinsing and repeating, said Mr Goh. This is a tested and proven flavour. For these projects, the group typically targets mid- to high-teens internal rates of return to reflect greenfield risk. Besides the current slate, he said the group has two other assets in the pipeline and aims to eventually manage four to five assets. It favours cities such as Sydney, Brisbane and Adelaide, where Mr Goh said the group has built strong capabilities and will continue to double down. Meanwhile, it is steering clear of Melbourne, citing foreign investor constraints, supply-demand concerns and construction costs. Asked whether a listed real estate investment trust (REIT) could be on the cards, Mr Goh said that was not a fixed goal, though it could be considered, especially since Wee Hur has gone through a decade-long phase of building capabilities. But for a listing to make sense, the group would need the right mix of assets and a sizable portfolio, alongside favourable regulatory and market conditions, including the pricing and returns investors expect from comparable REITs, said Mr Goh. On the home front, he said Wee Hurs recent moves – from developing the Wycombe Abbey school, partnering an Aravest fund toacquire Hotel Miramar for $160 million, to clinching an Upper Thomson government land sales site – reflect a deliberate strategy to expand its repertoire. He highlighted that the group intends to broaden its activities, pursuing projects opportunistically, while staying grounded in real estate. If a project is not in our circle of competence… we always have a partner, he said, citing Wee Hurs joint venture for Wycombe Abbey School (Singapore) and its partnership with local asset manager Aravest in acquiring Hotel Miramar Singapore,which they will rebrand as a Doubletree Hilton. At the same time, the group has clear limits on what it will not do, he said – such as data centres, which require large investments and are dominated by big players, as well as certain geographies such as Vietnam and India. While it stepped up deployment last year, Mr Goh said: I will say 2026 is a time for us to slow down, focus on execution, and then start building up more pipeline for next year. Some of the seeds that we sowed a few years back are starting to come to fruition. This year will be a little bit of harvesting, all the way to 2027. Wee Hur shares rose 1.3 per cent, or one cent, to 77 cents as at 9.20am on Jan 7.THE BUSINESS TIMES",https://www.straitstimes.com/business/companies-markets/wee-hur-partners-break-ground-on-wycombe-abbey-international-school-project-in-hougang
Nvidia says its revenue forecast has grown more bullish,"Jan 07, 2026, 08:28 AM","Jan 07, 2026, 10:35 AM",https://cassette.sphdigital.com.sg/image/straitstimes/e0d19d1a8fa98322221db054980bf7136cbfb1e819dc6f4512ca6bdd223fa64f,Nvidia CEO Jensen Huang speaking at the CES 2026 show on Jan 6.PHOTO: AFP,"['Nvidia', 'Semiconductors', 'AI/artificial intelligence']","SAN FRANCISCO- Nvidia, countering fears about an artificial intelligence (AI) spending bubble, said that an upbeat revenue forecast delivered in October has grown brighter due to strong demand. Large customer deals – and increasing uptake of new AI models – have brought in more orders than anticipated, the company said during presentations on Jan 7 at the CES 2026 show in Las Vegas. In October, Nvidia had projected about half a trillion dollars of revenue from current and future data centre chips by the end of 2026. Though the company didnt provide a new figure, it suggested that revenue in that time frame would eclipse the US$500 billion (S$640 billion) level. We should have a very good year, chief executive Jensen Huang said during a press conference. Deals with companies such as AI provider Anthropic, as well as improving prospects in China, should increase our expectations of that number. Nvidias outlook is crucial to allaying investor concerns about the AI industry. The company, which supplies the chips that power AI models, has maintained that customer spending will stay strong because the benefits are so large. For calendar 2026, Wall Street currently projects Nvidia will have total revenue of US$321.2 billion, an increase of 57 per cent. For 2027, they estimate the company will end the year with more than US$400 billion in sales. In separate remarks at a JPMorgan Chase event, Nvidia chief financial officer Colette Kress said that corporate data processing needs – rather than just AI – are also fuelling demand for next-generation computing. That will help overall investments reach multiple trillions by the end of the decade. That US$500 billion has definitely gotten larger, she said. Still, the remarks failed to impress investors. Nvidia shares fell 0.4 per cent to US$187.28 at the close in New York. They had gained 39 per cent in 2025. A key question is whether Nvidia can get back into the booming market for AI chips in China. US export restrictions have hobbled its business in that region, but the Trump administration has said that Nvidia can start selling its H200 chip to customers in the country. The customer demand is high, quite high, very high, Mr Huang said. Weve fired up our supply chain. H200s are flowing through the line. Mr Huang said the last details of licences from the US government are being finalised, and he does not expect any formal declaration of approval from Beijing. Chinese government sign-off will come in the form of allowing companies there to submit orders, he said. The previous day, Nvidia provided details about new chips that will go on sale in the second half of the year. Mr Huang also touted the power efficiency of the processors, which can deliver increased performance without requiring new computers to house them. His comments about cooling systems, meanwhile, caused ripples on Wall Street. Mr Huang said that racks of the new Rubin chips can be cooled with water that does not require a chiller. Shares of the companies that make cooling technology, such as Johnson Controls International, tumbled on Jan 6. Energy use has been another concern for the AI industry. Mr Huang dismissed fears about running out of power to feed data centres, calling shortages a normal consequence of industrial revolutions. He called for work on investing in all types of new power generation. BLOOMBERG",https://www.straitstimes.com/business/companies-markets/nvidia-says-its-revenue-forecast-has-only-grown-more-bullish
Chevron lines up 11 ships as Venezuelas dark fleet vanishes,"Jan 07, 2026, 07:56 AM","Jan 07, 2026, 08:33 AM",https://cassette.sphdigital.com.sg/image/straitstimes/e134c52ba126f5f3cd9dccd502c9206fb19a91b84c71bb11b50795cf0a04b883,Chevron continues to load oil as at least 12 vessels bound for Venezuela turned away under the heavy US military presence in the Caribbean.PHOTO: REUTERS,"['Venezuela', 'Oil and gas sector', 'United States', 'Nicolas Maduro']","HOUSTON– A small fleet of ships booked by Chevron is sailing to Venezuela as the company emerges as the only exporter of the countrys oil following the ouster of President Nicolas Maduro by US forces. At least 11 ships chartered by the US oil major are scheduled to arrive in the Venezuelan government-controlled ports of Jose and Bajo Grande in January, according to data compiled by Bloomberg. The data, which is preliminary, compares with nine vessels in December and is the highest since October, when 12 tankers loaded. The Houston-based company operates in Venezuela under a licence granted by the US Treasury Department and it is the only Western firm allowed to produce and export crude oil amid American sanctions. Chevron remains focused on the safety and wellbeing of our employees, as well as the integrity of our assets. We continue to operate in full compliance with all relevant laws and regulations, it said in a statement on Jan 6. Chevron continues to load oil as at least 12 vessels bound for Venezuela turned away under the heavy US military presence in the Caribbean. Two tankers used in the transport of sanctioned oil were caught in the US naval blockade. The US is now chasing a third tanker known as Marinera, or Bella 1, CBS News reported. Some vessels of the dark fleet were able to safely leave Venezuela over the weekend, right after US forces captured Mr Maduro, according to TankerTrackers.com. At least four tankers, and maybe as many as 16, got through the blockade, it said, without providing the names of the vessels. Tankers of the shadow fleet typically turn off or spoof their transponders to disguise their location. Out of the 11 Chevron-chartered vessels headed to the South American nation, one has already loaded and two others are docked, according to vessel movements tracked by Bloomberg. All the oil goes to refineries in the US, including Valero Energy, Phillips 66 and Marathon Petroleum. US President Donald Trump is banking thatoil companies will step in with big investments to revive production in Venezuelaafter years of corruption and neglect ravaged output, though crude producers are likely to proceed cautiously. US Energy Secretary Chris Wright plans to talk this week with oil industry executives. Venezuelan oil exports – measured by ship loadings – fell to a 17-month low in December amid the naval blockade designed to clamp down on its illicit oil trade. BLOOMBERG",https://www.straitstimes.com/business/companies-markets/chevron-lines-up-11-ships-as-venezuelas-dark-fleet-vanishes
Sandisk stocks 1000% rally turbocharged by Nvidia CEOs remarks,"Jan 07, 2026, 07:34 AM","Jan 07, 2026, 09:34 AM",https://cassette.sphdigital.com.sg/image/straitstimes/ebf4e1c43c979b8d22b0f8408eda5516d036efc61410a4fb6c577a0c50aa3d1e,Sandisk shares jumped after Nvidia CEO Jensen Huang highlighted the need for memory and storage in comments at tech conference CES 2026.PHOTO: SANDISK,"['Semiconductors', 'Nvidia', 'CEO']","NEW YORK- Sandisk shares jumped as much as 25 per cent on Jan 6, hitting a record in their best intraday performance since February, after Nvidia chief executive Jensen Huang highlighted the need for memory and storage in comments at tech conference CES 2026. The stock is on a tear, leaping more than 40 per cent in the first three trading sessions of 2026 and soaring roughly 1,050 per cent since hitting a low on April 22, 2025. It was the best performer in the S&P 500 Index on Jan 6, followed by memory and storage companies Western Digital and Seagate Technology Holdings, both of which are posting double-digit percentage gains. For storage, that is a completely unserved market today, Mr Huang said at CES on Jan 5. This is a market that never existed, and this market will likely be the largest storage market in the world, basically holding the working memory of the worlds AIs. Tight supply and a surge in memory pricing amid a growing need for artificial intelligence (AI) training and inferencing is helping to boost digital storage stocks, according to Bloomberg Intelligences Jake Silverman. Mr Huangs comments at CES suggest that demand for NAND storage will remain robust across Nvidia systems, he said. Memory prices have been steadily climbing. Earlier this week, Korea Economic Daily reported that Samsung Electronics and SK Hynix were seeking to raise server DRAM prices by 60 per cent to 70 per cent in the first quarter from the fourth quarter of 2025. Sandisk and other memory and storage companies are seen as key beneficiaries of the push for AI inferencing and AI at the edge in 2026, Bank of America analysts led by Mr Wamsi Mohan wrote in a note to clients on Jan 4. Mr Mohan expects organisations to retain increasing amounts of data for training, analytics and compliance purposes, with demand for storage skyrocketing in tandem. In particular, he cited growing use in drones, surveillance, vehicles and sports technology. The focus of the AI investment theme has been levered so far to capex spending and a push for training AI models, that has created the next wave in hardware spending, Mr Mohan wrote. As we look at 2026 and beyond, we expect AI Inference to dominate. BLOOMBERG",https://www.straitstimes.com/business/companies-markets/sandisk-stocks-1000-rally-turbocharged-by-nvidia-ceos-remarks
Chip stocks jump on AI optimism; Dow ends at record high,"Jan 07, 2026, 05:53 AM","Jan 07, 2026, 05:54 AM",https://cassette.sphdigital.com.sg/image/straitstimes/56fd06167e1ab13eb775c48eade01751fbf3c89ef01a991d8625c0bb2510bd93,"Traders working on the floor of the New York Stock Exchange, in New York City, on Jan 6.REUTERS","['Stocks and shares', 'Dow Jones', 'Nasdaq']","NEW YORK - Wall Street ended higher on Jan 6, as chip stocks surged on renewed AI optimism, Moderna rallied and the Dow Jones Industrial Average reached a record high. Moderna jumped almost 11 per cent after BofA Global Research raised its price target on the drugmaker, helping lift the S&P 500 healthcare index 1.96 per cent. Memory and storage technology stocks rallied after Nvidia chief executive officer Jensen Huang, speaking at the Consumer Electronics Show in Las Vegas, gave details about upcoming AI processors that include a new layer of storage technology. SanDisk jumped over 27 per cent, Western Digital rallied 17 per cent, Seagate Technology gained 14 per cent and Micron Technology rose 10 per cent, with all four stocks hitting record highs. The PHLX chip index also hit an all-time high, up 2.75 per cent for the day and bringing its gain in the first three trading sessions of 2026 to about 8 per cent. I think were going to have a very strong earnings season for Big Tech, and all those capex estimates that we hear about are going to be revised higher again, said Mr Jed Ellerbroek, portfolio manager at Argent Capital in St Louis. Investors are looking forward to reliable economic data as the effects of a record 43-day federal government shutdown wear off, and upcoming releases include the Job Openings and Labour Turnover Survey on Jan 7 and the jobs report for December on Jan 9. Weaker-than-expected employment data could strengthen the case for central bank interest rate cuts. Heading into fourth-quarter earnings season in the next few weeks, valuations on Wall Street remain relatively pricey. The S&P 500 is trading at about 22 times expected earnings, down from 23 in November, but above the indexs five-year average of 19, according to LSEG data. The S&P 500 climbed 0.62 per cent to end the session at 6,944.82 points. The Nasdaq gained 0.65 per cent to 23,547.17 points, while the Dow Jones Industrial Average rose 0.99 per cent to 49,462.08 points, nearing the historic 50,000 mark. Volume on US exchanges was relatively heavy, with 18.7 billion shares traded, compared with an average of 16.1 billion shares over the previous 20 sessions. Data on Jan 6 showed S&P Globals final composite PMI slipped to 52.7 in December from 53.0 in the prior month, while the services PMI eased to 52.5 from 52.9. Markets also parsed comments from Richmond Federal Reserve president Tom Barkin, who reiterated the US central banks careful take on further cuts, in contrast to governor Stephen Mirans call for aggressive cuts in a Fox Business interview. Investors brushed aside fears of broader geopolitical fallout after US forces captured Venezuelan President Nicolas Maduro over the weekend, betting the move could pave the way for US firms to gain access to Venezuelas oil reserves. Oil stocks dipped after robust gains in the prior session, with giants Exxon Mobil and Chevron losing 3.4 per cent and 4.5 per cent, respectively. Comments by Nvidias Mr Huang about the efficiency of the companys new chips raised concerns about demand for data centre cooling systems. Shares of Johnson Controls fell 6.2 per cent, while Trane Technologies dropped 2.5 per cent. AIG shares tumbled 7.5 per cent after the insurance giant said CEO Peter Zaffino would step down. Advancing issues outnumbered falling ones within the S&P 500 by a 3.1-to-one ratio. The S&P 500 posted 62 new highs and 8 new lows; the Nasdaq recorded 126 new highs and 42 new lows. REUTERS",https://www.straitstimes.com/business/companies-markets/chip-stocks-jump-on-ai-optimism-dow-ends-at-record-high
