title,publish_date,update_date,img_url,caption_text,tags_list,full_article,url
Bangladesh seeks to join international force in Gaza,"Jan 11, 2026, 06:56 AM","Jan 11, 2026, 06:56 AM",https://cassette.sphdigital.com.sg/image/straitstimes/bc6f49d24045d23c8ec61163981949b1e8867ddba0f92ec5daef9cc6ff87eaeb,"Palestinians walk near damaged buildings in the Gaza Strip, as seen from Israel, December 29, 2025. REUTERS/Amir Cohen","['Bangladesh', 'United States', 'Gaza']","WASHINGTON, Jan 10 - Bangladesh said on Saturday it has told the United States that it wants to join the international stabilization force that would be deployed in Gaza. Bangladesh said its national security adviser, Khalilur Rahman, met U.S. diplomats Allison Hooker and Paul Kapur in Washington. Rahman expressed Bangladeshs interest in principle to be part of the international stabilization force that would be deployed in Gaza, a Bangladeshi government statement added. It did not mention the extent or nature of its proposed involvement. The State Department had no immediate comment. A U.N. Security Council resolution, adopted in mid-November, authorized a so-called Board of Peace and countries working with it to establish a temporary International Stabilization Force in Gaza where a ceasefire began in October. The truce has not progressed beyond its first phase, and little progress has been made on the next steps. More than 400 Palestinians and three Israeli soldiers have been reported killed since the ceasefire took effect, and nearly all of Gazas more than 2 million people live in makeshift homes or damaged buildings in a sliver of territory where Israeli troops have withdrawn and Hamas has reasserted control. Both Israel and Hamas remain far apart on the more difficult steps envisaged for the next phase of the ceasefire and have accused each other of violations. Israels military assault on Gaza since late 2023 has killed tens of thousands, caused a hunger crisis and internally displaced Gazas entire population. Multiple rights experts, scholars and a U.N. inquiry say it amounts to genocide. Israel called its actions self-defense after a 2023 Hamas attack in which 1,200 were killed and over 250 taken hostage. REUTERS",https://www.straitstimes.com/asia/bangladesh-seeks-to-join-international-force-in-gaza
North Koreas Kim Yo Jong urges South Korea to investigate drone incidents,"Jan 11, 2026, 06:11 AM","Jan 11, 2026, 06:27 AM",https://cassette.sphdigital.com.sg/image/straitstimes/9660637bb304204ba24915182152d3e1697e6a0226b78208cd7bf550969541fb,"Fragments of a drone lie scattered on the ground in Muksan-ri area, Kaepung District, Kaesong City, North Korea, after North Korea said on Saturday that South Korea sent another drone into North Korean airspace on January 4, according to North Korean state media KCNA, in this picture released by North Koreas official Korean Central News Agency on January 10, 2026. KCNA via REUTERS","['North Korea', 'South Korea', 'Kim Jong Un']","SEOUL, Jan 11 - North Koreas Kim Yo Jong, the powerful sister of leader Kim Jong Un, urged South Korea to investigate recent drone incidents for detailed explanations, in a statement carried by state media KCNA on Sunday. Kim said she personally appreciates Seoul for making a wise decision to announce its official stance that it has no intention of provocation, warning that any provocations will result in terrible situations. Drones were flown from South Korea into North Korea earlier this month, after another intrusion in September, North Koreas military said on Saturday, which was soon followed by South Koreas response that they were not operated by the military. South Korea also said there would be a thorough investigation of a civilian possibly having operated the drones, making clear its stance of having no intention of provocation. Clear is just the fact that the drone from the ROK violated the airspace of our country, Kim said. ROK stands for the Republic of Korea, South Koreas official name. No matter who is the perpetrator and whether it is a deed by any civilian organization or individual, the authorities responsible for national security can never evade their responsibility for it, she said. REUTERS",https://www.straitstimes.com/asia/north-koreas-kim-yo-jong-urges-south-korea-to-investigate-drone-incidents
6.8-magnitude earthquake strikes off Indonesias Talaud Islands,"Jan 10, 2026, 11:56 PM","Jan 11, 2026, 04:25 AM",https://cassette.sphdigital.com.sg/image/straitstimes/c772f1d9808e08c38e3e7abdc2f35f12df1e101de74ed35e9d66e3a32d856908,,"['Indonesia', 'Earthquakes', 'Natural disasters']","JAKARTA - An earthquake of 6.8 magnitude struck off the coast of Indonesias Talaud Islands on Jan 10, the German Research Center for Geosciences (GFZ) said. The quake was at a depth of 77km, GFZ said. Indonesian geophysics agency BMKG reported a 7.1-magnitude reading, at a depth of 17km. It also reported a few subsequent quakes. BMKG said the quakes do not have the potential to trigger tsunami waves. Some people in Manado on the northern tip of Sulawesi island said the quake was felt strongly there. There were no immediate reports of damage. Indonesia straddles the so-called Pacific Ring of Fire, an area of high seismic activity where multiple tectonic plates meet and earthquakes are frequent. REUTERS",https://www.straitstimes.com/asia/se-asia/magnitude-6-8-earthquake-strikes-off-indonesias-talaud-islands-gfz-says
Beware of bears: Japans 2025 kanji character reflects worries over attacks on humans,"Jan 10, 2026, 06:00 PM","Jan 10, 2026, 10:56 PM",https://cassette.sphdigital.com.sg/image/straitstimes/e10b3e7aae62cdba58d3469b550c89743d30ed407fd8ec39fcc7f24eaded538f,"Visitors taking photos next to a bear warning sign at Shirakawa-go, a popular tourist spot and one of Japans UNESCO World Heritage sites, on Nov 15.PHOTO: REUTERS","['Japan', 'Wildlife', 'Animals', 'Field Notes']","TOKYO–Snowboarding coach Makoto Kuroki was carving his way through fresh back-country powder in Hakuba on Dec 7, filming his smooth runs on the slopes, when he had an unexpected encounter. A black bear briefly emerged from the wilderness and appeared to chase him before scampering away.What began as a showcase of his firstsnow-skatingrun of the winter quickly went viral – and made national headlines – as a vivid symbol of a national crisis.",https://www.straitstimes.com/asia/east-asia/beware-of-bears-japans-2025-kanji-character-reflects-worries-over-attacks-on-humans
Man arrested on suspicion of hiding womans body in wall of bar he runs in Japans Hokkaido,"Jan 10, 2026, 05:19 PM","Jan 10, 2026, 11:57 PM",https://cassette.sphdigital.com.sg/image/straitstimes/c6373d8db997228db8bca9b216a18c741fa8381b146eebe8314b289c0339c418,"The bar, on Jan 10, where a womans body was hidden in a wall in Hidaka, Hokkaido, in Japan.PHOTO: THE JAPAN NEWS/ASIA NEWS NETWORK","['Japan', 'Crime', 'Crimes against women']","SAPPORO – A 49-year-old man was arrested Jan 10 in Hidaka, Hokkaido, for allegedly hiding a womans body inside a wall of a bar he runs, the police said. According to the Hokkaido prefectural police, the man is believed to have hidden the body of a female acquaintance inside the wall around Dec 31. The police said that the suspect admitted to the charges, saying: I definitely hid the body inside the wall. The prefectural police said the body was believed to be that of a woman in her 20s who could not be contacted since the evening of Dec 31. A missing person report had been filed with the police. THE JAPAN NEWS/ASIA NEWS NETWORK",https://www.straitstimes.com/asia/east-asia/man-arrested-on-suspicion-of-hiding-womans-body-in-wall-in-japans-hokkaido
"20 Air Force officers believed to be involved in yeye culture, says RMAF chief","Jan 10, 2026, 04:44 PM","Jan 10, 2026, 04:44 PM",https://cassette.sphdigital.com.sg/image/straitstimes/d946809b8d1d088143c4d4af391e61c1ee481870b8f83eb8867dd0652fc556af,Claims have been circulating on social media alleging that immoral activities occurred in Malaysias military camps.PHOTO: MOD.GOV.MY,"['Malaysia', 'Defence and military', 'Social media']","KUALA LUMPUR - Some 20 Royal Malaysian Air Force (RMAF) officers are believed to be involved in immoral activities dubbed yeye culture. RMAF chief Jeneral Datuk Seri Muhamad Norazlan Aris saidinitial investigations by the Air Forceon Jan 6 revealed that 20 officers were involved. We will ensure action will be taken based on the Armed Forces laws and regulations. Such immoral culture is not the norm for the Air Force, he said in a statement on Jan 10. Mr Norazlan said the Air Force views the infringement of the order, directive and rules seriously. We will take stern action without compromise. The RMAF leadership deeply regrets the incident that occured and we will also take necessary action against those who failed to follow orders, he added. Previously Mr Norazlan had said the RMAF will not compromise on any form of misconduct or disciplinary breach amid allegations of unauthorised entry and immoral activities at a military camp. He said a thorough investigation was underway and that stern action, including dismissal from service, would be taken against those found guilty. Stern action will be taken in accordance with service regulations to safeguard the image, dignity and professionalism of the RMAF, he said in a statement on Jan 7, while expressing regret over the allegations. Mr Norazlan stressed that any form of immoral conduct within air bases was strictly prohibited, as it tarnished the image and dignity of the RMAF, adding that he viewed every issue involving the discipline and integrity of officers and personnel very seriously. The Defence Ministry has also ordered the Armed Forces to conduct an internal investigation into allegations that unauthorised individuals had entered military camps and that immoral activities had taken place within the premises, following claims that went viral on social media. Since last week, claims have been circulating on social media alleging that immoral activities occurred in military camps involving outsiders and military officers. THE STAR/ASIA NEWS NETWORK",https://www.straitstimes.com/asia/se-asia/20-air-force-officers-believed-to-be-involved-in-yeye-culture-says-rmaf-chief
Indonesia records first death linked to super flu,"Jan 10, 2026, 04:28 PM","Jan 10, 2026, 07:08 PM",https://cassette.sphdigital.com.sg/image/straitstimes/0c8c2ab891a6ac6ea243b77fb78e9a260d023a2dffaa867b4d29a6d59ef68996,"According to assessments by the World Health Organization, subclade K has not been linked to increased disease severity.PHOTO: THE JAKARTA POST/ASIA NEWS NETWORK","['Influenza', 'Health and well-being', 'Indonesia']","BANDUNG-A hospital in Bandung, West Java, has reported Indonesias first death linked to the so-called super flu, as health authorities step up surveillance to contain the virus. The term super flu refers to the H3N2 influenza A variant known as subclade K, which has been spreading globally since the final quarter of 2025.",https://www.straitstimes.com/asia/se-asia/indonesia-records-first-death-linked-to-super-flu
Indonesia temporarily blocks access to Grok over sexualised images,"Jan 10, 2026, 03:27 PM","Jan 10, 2026, 09:01 PM",https://cassette.sphdigital.com.sg/image/straitstimes/a94cf17ba657ea71ea7d7537d1456f07354dd4a7ebd63587e1ddba9a04316e03,Indonesia is the first country to deny access to Grok.PHOTO: REUTERS,"['AI chatbot', 'Twitter', 'Indonesia', 'AI/artificial intelligence', 'Artificial Intelligence']","JAKARTA– Indonesia temporarily blocked Mr Elon Musks Grok chatbot on Jan 10 due to the risk of AI-generated pornographic content, becoming the first country to deny access to the AI tool. The move comes after governments and regulators from Europe to Asia have condemned and some haveopened inquiries into sexualised content on the app. xAI, the start-up behind Grok, on Jan 8 said it wasrestricting image generation and editingto paying subscribers as it tried to fix safeguard lapses that had allowed sexualised outputs including depictions of scantily clad children. The government views the practice of non-consensual sexual deepfakes as a serious violation of human rights, dignity and the security of citizens in the digital space, Communications and Digital Minister Meutya Hafid said in a statement. The ministry has also summoned X officials to discuss the matter. Mr Musk said on X that anyone using Grok to make illegal content would suffer the same consequences as if they had uploaded illegal content. xAI replied to Reuters e-mail seeking comment with what seemed to be an automated response – Legacy Media Lies. X did not immediately respond to a request for comment. Indonesia, with the worlds biggest Muslim population, has strict rules that ban the sharing online of content deemed obscene. REUTERS",https://www.straitstimes.com/asia/se-asia/indonesia-temporarily-blocks-access-to-grok-over-sexualised-images
Malaysia border agency advises foreign travellers to use NIISe app following autogate crash,"Jan 10, 2026, 03:07 PM","Jan 10, 2026, 10:21 PM",https://cassette.sphdigital.com.sg/image/straitstimes/65615d181e811c2c696a960d144070fb0f1c265f33066c29975d50e252b1ea14,"Foreigners at the Bangunan Sultan Iskandar Customs, Immigration and Quarantine Complex had to wait up to two hours to clear immigration on Jan 10.PHOTO: THE STAR/ASIA NEWS NETWORK","['Johor', 'Woodlands Checkpoint', 'Malaysia']","JOHOR BAHRU– Foreign travellers in Malaysia are advised to use the new National Integrated Immigration System (NIISe) while going through immigration at a main checkpoint following a system failure involving its autogates, says the Border Control and Protection Agency (AKPS) on Jan 10. AKPS said, besides NIIse, foreigners could also use the manual counters to clear immigration. AKPS, in a statement on Facebook, said that the e-gates at the Bangunan Sultan Iskandar Customs, Immigration and Quarantine Complex (BSI) were experiencing technical problems involving those holding foreign passports. However, Malaysians can use the system without any issues. AKPS said that at press time, the movement of people at all zones was smooth, and the Immigration Department and AKPS were carrying out monitoring and rectifying works. Tens of thousands of foreigners were reported earlier to be stuck in long queues at Malaysias two land checkpoints with Singapore following a major technical glitch which knocked out most of the immigration autogates on Jan 10. The worst affected is the Bangunan Sultan Iskandar Customs, Immigration and Quarantine Complex (BSI), where foreigners have been forced to wait up to two hours to clear immigration. It was learnt that at least 39 autogates at the entry and 29 machines at the exit areas of the bus halls at BSI had experienced problems for a few days, but the system crashed totally on Jan 10 due to the huge influx of foreigners during the weekend. The Sultan Abu Bakar Customs, Immigration and Quarantine Complex (KSAB) has 12 autogates. Malaysians using their local passports are still able to use the autogates, while the system for motorcycles and cars was also functioning properly. Even the autogates at the KTM (Keretapi Tanah Melayu) train station at BSI were knocked offline, a security official said, adding that efforts were being made to restore the system in stages. This is the first major disruption this year, and the timing is bad, especially when we are getting a lot of foreign visitors in conjunction withVisit Malaysiaand Visit Johor 2026, the official said. The official added that the Malaysian Border Control and Protection Agency (AKPS) has been directed to open up all the manual counters to handle the influx of people. The official said that so far, the situation at KSAB was still manageable. Facebook user Joy Ce said that it took about three hours to get her passport stamped. In July 2025,a similar incidenthappened, with a breakdown in autogates in major checkpoints around the country affecting more than 380,000 foreigners. At press time, AKPS was in the midst of issuing an official notification about the disruption to urge visitors to be prepared for delays. Since June 1, 2024, visitors from 63 countries, as well as diplomats serving in Malaysia and their family members, have been eligible to use the autogates for faster clearance. THE STAR/ASIA NEWS NETWORK",https://www.straitstimes.com/asia/se-asia/autogate-crashes-strand-thousands-at-land-checkpoints-in-johor
"While You Were Sleeping: 5 stories you might have missed, Jan 11, 2026","Jan 11, 2026, 07:04 AM","Jan 11, 2026, 07:04 AM",https://cassette.sphdigital.com.sg/image/straitstimes/bbef7b1da2eb99fb8f58e8c42c6f1db6e279896050ab312502d5a4ec3615359a,"The US launched air strikes in Syria against ISIS targets, in its latest response to the killing of three Americans on Dec 13.SCREENSHOT: X/@CENTCOM","['United States', 'Syria', 'ISIS', 'Air strikes', 'Elon Musk']","US and allied forces carried out large-scale strikes against the Islamic State militant group in Syria on Jan 10, the US military said, in the latest response to an attack in December that left three Americans dead. Washington said a lone gunman from the militant group carried out the Dec 13 attack in Palmyra - home to UNESCO-listed ancient ruins and once controlled by militant fighters - that killed two US soldiers and a US civilian interpreter. The strikes today targeted ISIS throughout Syria and were part of Operation Hawkeye Strike, which was launched in direct response to the deadly ISIS attack on US and Syrian forces in Palmyra, US Central Command said in a statement on X, using an acronym for the group, which is known as Islamic State in Iraq and Syria. The US and Jordan carried out a previous round of strikes as part of the same operation in December, hitting dozens of ISIS targets. READ MORE HERE Social media platform X will open its new algorithm to the public in seven days, Elon Musk said on Jan 10, including the code used to decide what posts and advertisements are recommended to users. This will be repeated every 4 weeks, with comprehensive developer notes, to help you understand what changed, Mr Musk, who owns X, said in a post on the platform. The billionaire didnt say why X was making its algorithm open source. He and the company have clashed several times with regulators over content being shown to users. READ MORE HERE Minneapolis Mayor Jacob Frey on Jan 10 urged demonstrators protesting the fatal shooting of a motorist by a US immigration agent to stay peaceful, saying that any unlawful actions would play into US President Donald Trumps hands. Mr Frey, a Democrat, cautioned them as civil liberties and migrant-rights groups prepared nationwide rallies to protest the killing of 37-year-old Renee Good by an Immigration and Customs Enforcement officer on Jan 7. Minnesota and US officials have offered starkly different accounts of the shooting. READ MORE HERE A protester briefly replaced the flag of the Islamic Republic of Iran on its London embassy with a former flag, flown before 1979, during a demonstration on Jan 10, witnesses told AFP. A video posted to social media showed a man on the balcony of the embassy, near Hyde Park, replacing the countrys current flag with one used during the rule of the ousted shah to cheers from hundreds of demonstrators below. The flag - tri-coloured, with a lion and sun, surrounded by a wreath and crown - was a ceremonial one used in Iran before the Islamic revolution. READ MORE HERE Crystal Palaces defence of the FA Cup came to an embarrassing end as they were beaten 2-1 by sixth-tier Macclesfield on Jan 10 in the biggest shock in the competitions history. The 117 places that separate Premier League outfit Palace from Macclesfield of the National League North in the English football pyramid is the most ever overcome by an underdog in FA Cup history. Captain Paul Dawson and Isaac Buckley-Ricketts scored either side of half-time to secure a famous victory for a club that were forced to reform in 2020 after being wound up for unpaid debts. READ MORE HERE",https://www.straitstimes.com/world/while-you-were-sleeping-5-stories-you-might-have-missed-jan-11-2026
"Ukrainian drone attack injures four, damages buildings in Russias Voronezh, governor says","Jan 11, 2026, 05:46 AM","Jan 11, 2026, 05:46 AM",https://cassette.sphdigital.com.sg/image/straitstimes/a1c6c0831c7e2c0968e46225bbeb5ecad051159eb874fa6387ec34c1ae2705ee,,"['Buildings', 'Russia', 'Energy']","Jan 10 - An overnight Ukrainian drone attack injured at least four people and damaged several buildings in Russias southern city of Voronezh, governor of the Voronezh region said on Sunday. An emergency service facility, seven apartment buildings and six houses were damaged as a result of the attack, the governor, Alexander Gusev, said on the Telegram messaging app. Reuters was not able to independently verify the reports. Ukraine says it strikes targets inside Russia in the war that Moscow launched nearly four years ago to disrupt the Kremlins war effort and in response to repeated missile and drone attacks on Ukrainian cities and infrastructure, including energy facilities. Russia launched a hypersonic missile on Friday at a site in Ukraine near NATO-member Poland, a strike Kyivs European allies portrayed as an effort to deter them from continuing support for Ukraine. REUTERS",https://www.straitstimes.com/world/europe/ukrainian-drone-attack-injures-four-damages-buildings-in-russias-voronezh-governor-says
