title,publish_date,update_date,img_url,caption_text,tags_list,full_article,url
Airfares from Singapore to Malaysia soar up to 6 times during CNY period; train tickets sold out,"Jan 11, 2026, 05:00 AM","Jan 11, 2026, 05:00 AM",https://cassette.sphdigital.com.sg/image/straitstimes/7499c299343d5cabd0914f6141337de0666837ad4c1b8bc60a10e9ac9214cd78,"A two-way trip from Singapore to Kuala Lumpur by air would range from $420 to $1,245 in the days leading up to Chinese New Year.ST PHOTO: KUA CHEE SIONG","['Chinese New Year', 'Singapore transport', 'Malaysia']","SINGAPORE – Getting his hands on flight tickets to return to his home town in Ipoh, Malaysia, during Chinese New Year is a feat that Mr Tan Yik Xuan has to pull off every year. Mr Tan, a 26-year-old who works in logistics in Singapore, purchased return flight tickets in October 2025 – four months ahead of Chinese New Year in 2026 – for around $630. He had bought them significantly earlier because he was worried that he would not be able to secure tickets. Describing the higher fare as much more expensive than the usual cost of less than $320 for a round trip during off-peak seasons, Mr Tan said he is still willing to pay more to fly to Ipoh instead of taking a bus because of the shorter travel time and absence of traffic jams. Checks by The Straits Times in the week starting Jan 5 found that a two-way economy class ticket to Ipoh costs between $822 and $1,222 for travel from Feb 14 to 19, more than six times the fare of $124 to $191 for the week before. Those making last-minute travel plans to Malaysia during this festive period are set to pay higher prices. Chinese New Year falls on Feb 17 and 18, with many Malaysians heading home for the reunion dinner that typically takes place on the eve. A two-way trip from Singapore to Kuala Lumpur by air would range from $420 to $1,245 in the days leading up to Chinese New Year, compared with a fare between $99 and $345 from Feb 7 to 12. Meanwhile, round-trip air tickets from Singapore to Penang would cost $628 to $1,049 from Feb 14 to 19, higher than the price range of $107 to $469 for the week before. Responding to STs queries, AirAsia said on Jan 8 that its pricing model reflects supply and demand – where fares will typically be higher when purchased closer to the travel date or for travel during peak seasons. The airline added that it will be introducing over 7,500 more seats on additional flights between Singapore and KL, Penang and Kuching during the upcoming Chinese New Year travel season, starting from Feb 13. Citing commercial sensitivities, national carrier Singapore Airlines and its budget arm Scoot declined to disclose booking figures but said they continue to observe healthy passenger demand during the Chinese New Year period in 2026. For buses, STs checks showed that round-trip bus tickets to KL could range from $89 to $276 for Feb 14 to 19, an increase from the $51 to $153 the week before. A two-way bus ticket to Penang for Feb 14 to 19 could cost $198 to $370, while a similar ticket to Ipoh over the same period could go up to $214 to $330. But from Feb 7 to 12, a week before the festive period, a two-way bus ticket to Penang was priced at $83 to $133, while a similar ticket to Ipoh cost $71 to $104. Malaysian bus operator Causeway Link said it anticipates a significant crowd and a high volume of ticket purchases during the upcoming peak season. It declined to provide ridership figures. It added that it will continue monitoring the situation, with backup buses on standby to support increased passenger demand whenever necessary. To avoid paying too much for a coach ride back to her home town in Batu Pahat in the north-west of Johor, Ms Lim Cin Min, 27, will be taking a Causeway Link bus from Woodlands Checkpoint to the Johor Bahru immigration and Customs before catching another bus from Larkin Sentral bus terminal. The whole journey on Feb 13 will cost her around $8. The insurance agent noted that this is more affordable than taking a direct bus service from Singapore to her home town, which could cost up to $40 during the festive season. She added that she prefers this alternative route, as she finds it more comfortable and efficient to cross immigration herself, instead of being stuck in traffic jams in both Singapore and Malaysia. Following thelaunch of the first electric train service (ETS)from Johor Bahru to KL on Dec 12, 2025, some Malaysians are turning to this new transport option to return home for Chinese New Year. According to ST checks, ETS tickets for services to KL from Feb 13 to 16 are no longer available for booking, as well as those from Feb 11 to 22 for the single daily service from Johor Bahru to Ipoh, with the exception of designated wheelchair spaces. For those travelling to Penang, the same applies for ETS services from KL to Butterworth from Feb 13 to 16. And even for the Keretapi Tanah Melayu Shuttle Tebrau connecting Woodlands Checkpoint in Singapore to Johor Bahru Sentral in Malaysia, there are no available tickets for sale from Feb 13 to 15. Mr Justin K, 29, is among the few lucky passengers who managed to secure an ETS ticket in December 2025 for his ride back to Johor Bahru from KL on Feb 24, 2026. The data analyst, who agreed to be interviewed on the condition of partial anonymity, said he managed to get an ETS ticket only because he extended his visit beyond the peak travel period during Chinese New Year. He will be taking an AirAsia flight to KL on Feb 14, as ETS tickets for that leg were sold out for the week leading up to Chinese New Year when he checked. He paid $230 for a one-way ticket, which he said was more than twice the normal fare. Noting that his ETS ticket cost only RM110 (S$35), including a fare increase of RM20 for the Chinese New Year period, Mr K said this is a much more palatable increase compared with that of airfares. He added that he will be making future journeys back to his home in Malaysia on the ETS – even if he has to book his seat weeks in advance – because of its punctuality, fixed travel duration and comfort.",https://www.straitstimes.com/singapore/transport/air-fares-from-singapore-to-malaysia-soar-up-to-6-times-during-cny-period-train-tickets-sold-out
"Judge slashes lawyers plainly excessive bills from over $108,000 to $34,000","Jan 11, 2026, 05:00 AM","Jan 11, 2026, 05:00 AM",https://cassette.sphdigital.com.sg/image/straitstimes/db72e3a13d74f27e33acb451980ad393f879dde688acc35edb189e728e73ee48,Arbiters Law Corporation has filed an appeal to the High Court against the district judges decision.ST PHOTO: KELVIN CHNG,"['Singapore lawyers', 'Singapore courts', 'Civil lawsuits']","SINGAPORE – A lawyer, who was found in 2024 to haveovercharged a couple for handling a lawsuit over their sons death, has had his bills found to be plainly excessive again in a separate case involving another client. Mr Vijay Kumar Rai of Arbiters Inc Law Corporation had billed this client $108,225 in fees for work done over a seven-month period in 2023 before the trial even started. The amount was slashed to $34,000 by District Judge Chiah Kok Khun, after the client asked the courts to assess the bills. In his written judgment on Dec 22, 2025, the district judge cited the findings of a High Court judge, who had said at an earlier stage of the bill dispute that the fees claimed by Mr Rai were excessive. Arbiters has since filed an appeal to the High Court against Judge Chiahs decision. In December 2024, the Appellate Division of the High Court had found that Mr Rai overcharged a couple who engaged him to file anegligence suit over the suicide of their 31-year-old son. The couple had dropped their lawyers and settled the case on their own for $330,000. After the settlement, Arbiters sued the couple to press for payment of bills amounting to about $370,000. The bill was reduced to $87,000 by the Appellate Division of the High Court in December 2024. The three-judge court said the costs claimed by Mr Rai were so plainly excessive as to amount to overcharging. The Appellate Division also referred Mr Rais conduct to the Law Society of Singapore for a disciplinary inquiry. In the current case, Mr Rai acted for a beauty salon, De Beaute, in a civil suit against a former employee forcoercing other staff to perform treatments on her for freeand pocketing customers monies. His firm took over the case in February 2023 and provided a fee estimate of $70,000 up to the end of trial. De Beaute paid the first seven invoices totalling $33,285, each charging around $4,000 and $5,000 in professional fees. In September 2023, before trial dates were fixed, Arbiters issued an eighth invoice charging $40,000 in fees. De Beaute discharged Arbiters as its lawyers and later engaged Mr Gavin Neo of WongPartnership to handle the lawsuit and the dispute over the bills. In October 2024, a district judge agreed with De Beautes request for the bills to be assessed by the court. Arbiters appealed to the High Court against this decision. Mr Rai argued that he had carried out an enormous amount of work due to the complexity of the matter. The appeal was dismissed in March 2025 by Justice Dedar Singh Gill, who found the amounts in the invoices to be plainly excessive. He said the matter was not as complex as Mr Rai made it out to be. The bills were then assessed by a State Courts deputy registrar, who reduced the fees from $108,225 to $46,000 in August 2025. Arbiters then applied for a review of this decision. Judge Chiah, who heard the arguments, further reduced the bills to $34,000. The sum comprised $30,000 for work done in the preparation and review of affidavits, and $4,000 for attending a pre-trial hearing. In his written judgment, Judge Chiah said he took into account the costs guidelines for tort and commercial cases, the fee estimate initially provided by Arbiters, and the legal costs that were ultimately awarded to De Beaute in October that year after the firm won the suit.",https://www.straitstimes.com/singapore/courts-crime/judge-slashes-lawyers-plainly-excessive-bills-from-108k-to-34k
,,,,,[],,https://www.straitstimes.com/singapore/who-goes-missing-in-singapore
Wanted: More blood donors of all ages,"Jan 11, 2026, 05:00 AM","Jan 11, 2026, 06:26 AM",https://cassette.sphdigital.com.sg/image/straitstimes/4aefe11360c524e7abe66469ece219c72e4f914e6945bf8b35e7810dd145aa32,"Since Jan 2, the upper age limit for first-time blood donors in Singapore has been raised from 60 to 65.ST PHOTO: NG SOR LUAN","['Blood donation', 'Health Sciences Authority', 'Red Cross', 'Senior citizens']","SINGAPORE – Mr Lian Tian Teng is pumped for his 235th blood donation in a weeks time. While he is among Singapores more prolific donors, the 61-year-old is hoping to induct fresh blood among peers his age. Since Jan 2, the upper age limit for first-time blood donors in Singapore has been raised from 60 to 65, in a move to expand the city-states blood supply in tandem with longer life expectancy and better health in older age. The change means that new donors can give blood up to one day before their 66th birthday, while repeat donors can continue to do so until the age of 75, up to one day before their 76th birthday. Donors must, in general, be in good health, free of infection symptoms and weigh at least 45kg. Local data showed that adverse donor reactions such as fainting and dizzinessdecrease among first-time donorsas they get older. Health Minister Ong Ye Kung had announced the change in June 2025. The new age limit also aligns with practices in jurisdictions such as Hong Kong, Taiwan, Ireland, the Netherlands, South Korea and Britain, which generally allow first-time donors aged 65 to 69. Mr Lian, a Tower Transit facilities executive, said he has been encouraging his friends to give blood donation a try. There is no need to fear – the environment is so cosy and the expertise of the nurses makes it a good experience, said the regular donor at Bloodbank@HSA in Outram. While a handful of new donors in this age group have come forward, the Health Sciences Authority (HSA) said it is hopeful that the move will see many more seniors like Mr Lian contribute to Singapores national blood programme. HSA chief executive Raymond Chua said: With our ageing population, it is crucial that we tap every safe opportunity to expand our donor pool while maintaining the highest safety standards for both donors and recipients. Meanwhile, efforts to recruit younger donors are starting to bear fruit. The Singapore Red Cross (SRC) noted that there have been close to 900 sign-ups for the YouthInspire club from December 2024 to November 2025. The club, launched in 2024 to encourage those aged 16 to 25 to donate blood, organises ground-up activities to encourage peer-to-peer donor recruitment. SRC also held its own youth-centric roadshows, working with schools and institutions of higher learning to promote and educate young people on the importance of blood donation, and to dispel misconceptions such as blood donation being painful. In 2023, SRC launched the YOUTHphoria award on World Blood Donor Day to inspire more young people to donate blood regularly. It has also rolled out digital initiatives like the DonateBlood app, as well as the HeyBloodBuddy account on Instagram and TikTok to engage the next generation of potential donors. In 2024, those aged 25 and below accounted for 14 per cent of the total donor pool. This was a decline from 2011, when one in three blood donors was a young person. Mr Prakash Menon, group director for SRCs blood donor programme, said that getting more youth to donate blood will be a long-term effort. Drawing from our learnings in 2025, we will scale up successful initiatives while refining our approach, he said. Our focus remains on engaging donors across all age groups through upcoming events, including the National Blood Programmes 80th anniversary celebrations in 2026. Overall donor numbers typically fall during festive periods, school holidays and long weekends. This is because many people travel overseas and become ineligible to donate blood for a period depending on the countries or regions they visit. For instance, donors who have travelled to places with insect-borne diseases may be ineligible to donate for up to four months after their return. Adjunct Professor Chua said: The early part of the year, especially around Chinese New Year, tends to be challenging, and we hope more will step forward to ensure the country has stable blood reserves. Every donation will make a critical difference for many patients across Singapore. We hope that with such changes to age, and with our five blood banks located islandwide at Dhoby Ghaut, Jurong East, Outram, Punggol and Woodlands, more people across all ages would step forward. The Republic had just under 80,000 donors in 2024, or about 1.3 per cent of the population, according to latest available data. In 2025, 14 units of blood were required every hour in Singapore, or about 120,000 units for the year. A standard donation yields one unit, or about 350ml to 450ml. Mr Lian, the veteran blood donor, said he will keep exercising and watching his diet so that he can give blood for as long as possible. What keeps me going? Its my passion and the knowledge that my little contribution can make a difference in saving lives, he said. Those who wish to donate blood can book a slot today through the DonateBlood app or athsa.gov.sg/make_an_appt",https://www.straitstimes.com/singapore/community/wanted-more-blood-donors-of-all-ages
Stallholders say HDBs move to make budget meals optional offers some relief amid rising costs,"Jan 10, 2026, 09:00 PM","Jan 10, 2026, 11:09 PM",https://cassette.sphdigital.com.sg/image/straitstimes/03849458f610480afde7c65507b478e15fdcf0cf9637d3d468c21b45bdecf952,"The move also acknowledges shortcomings in the previous scheme, which had drawn some criticism over uneven food quality and low take-up among customers.ST PHOTO: NG SOR LUAN","['Coffee shop', 'Food prices', 'HDB', 'Cost of living', 'Singapore inflation']","SINGAPORE – Coffee shop operators and stallholders saidmaking budget meals optionalwill ease some pressure, given the challenges of rising costs. The move also acknowledges shortcomings inthe previous scheme, which had drawn some criticism over uneven food quality and low take-up among customers. The Housing Board announced on Jan 10 that coffee shop operators renewing leases from that date would no longer be required to sell budget meals, a scheme aimed at keeping food affordable in the heartland. Stallholders told The Straits Times that demand for budget meals varies widely, with some stalls selling as few as 50 meals a month while others sell around 50 a day. Several said keeping prices at $3.50 or less often meant serving smaller portions to manage costs. HDB said it does not set budget meal prices, which are proposed by operators and typically priced at around $3.50. At a FoodHub-operated coffee shop at Block 40 Margaret Drive, demand for budget meals varies widely. At Al-Madina Famous Prata Corner, the $2.50 option – consisting of rice, chicken, chicken curry, and cabbage – attracts about 50 customers a month. Stall assistant Rahim said it mainly appeals to older patrons. Young people wont be full, he said, pressing his fingers together to show the modest serving. Its really meant for old people. At Shu Vegetarian, fewer than 40 budget meals are sold monthly. Stall assistant Ng Cheng Yong said the $2.50 meal is the same portion size as a regular dish but without mock meat, leaving only noodles and vegetables. Demand is highest at the economy rice stall, which sells 50 to 60 budget meals daily. Each set, limited to two vegetable dishes and one meat dish with no substitutions, is kept small to meet the price cap, said Mr Wong Yin Keong, 48. This is old peoples food, he said in Mandarin. Mr Paul Kok, managing director of FoodHub, said that some stalls have struggled to offer budget meals priced at $3.50 or less amid rising operating costs. Some operators reduced portions to cope, which sometimes led to customer complaints. Under the new optional framework, operators who choose to offer budget meals will receive more support. HDB-let coffee shops will get a 5 per cent rental discount across the full three-year tenancy instead of just the first year, while privately owned outlets will receive discounts on temporary occupation licence fees. Participating operators must pass the full value of incentives to stallholders providing budget meals. If the amount is acceptable to the stallholders, we will opt in. But if it is not enough to cover expenses, we will listen to their feedback and may decide not to opt in, said Mr Kok. The revised scheme also standardises budget meal requirements. Operators who opt in must provide three meal choices and two drinks, including an economy rice option with one meat and two vegetable dishes, one halal meal, and one breakfast item. Mr Kok said the managers of each FoodHub outlet will discuss with stallholders whether to opt in when leases are renewed, with each outlet making its own decision. Of FoodHubs more than 40 coffee shops, about two are up for lease renewal in 2026. Nearby, at a Koffee Time coffee shop in Block 85 Dawson Road, demand for budget meals is limited, with only about 10 orders a month at the Malay stall. Ms Siti Aliza, who mans the stall, said most customers prefer to pay 50 cents to $1 more for a full meal. Patrons said they understand the constraints that stallholders face. Ms Sharon, 58, who wanted to be known only by her first name, said: They have to work within a price they can sell, so theres only so much they can do. Another patron, who wanted to be known only as Madam Lee, 75, said the portions, though small, suit her needs. What can you expect, given the price? she said, adding that she appreciates the $2 breakfast set of coffee, two eggs, and kaya toast at the coffee shop in Margaret Drive. Not everyone can afford to eat more expensive food, she said. Mr John Tan, 35, who used to own and operate a coffee shop in Beo Crescent in Bukit Merah, said offering budget meals was a challenge. Stallholders were struggling to make ends meet as costs, such as electricity and utilities fees, had gone up, he added. Mr Tan sold the coffee shop in 2024 but continued operating it until late 2025. Veteran food critic K.F. Seetoh said the changes have no impact on operators, who are still collecting rents. But it is good news for hawkers, who will no longer be forced to offer budget meals with little demand. He said stallholders should have an open field to charge whatever they think is fair as they know their customers best. Mr Seetoh, who is the founder of local food guide Makansutra and curator of the Urban Hawker food centre in New York City, added that the changes are an acknowledgment that the previous scheme did not work as intended. It is good the Government has its ear to the ground, but they have to keep listening to the hawkers, he said. Mr Seetoh suggested alternative approaches in the spirit of keeping meals affordable, such as direct subsidies for hawkers. Those who are truly disadvantaged and need cheap or even free meals could be identified through a system similar to the CHAS card. Many hawkers are happy to give them a free or cheap meal and to pay it forward, he said. It is unfair to put the pressure of taking care of the poor on hawkers struggling with the bottom line, he added. Making the scheme voluntary improves its sustainability to some extent, he said. It at least takes the burden away from hawkers. Additional reporting by Ng Sor Luan",https://www.straitstimes.com/singapore/transport/hdbs-move-to-make-budget-meals-optional-offers-some-relief-amid-rising-costs
